Document Title,Authors,Author Affiliations,Publication Title,Publication Title
Sentiment Analysis of Bangladesh-specific COVID-19 Tweets using Deep Neural Network,M. N. Islam; N. I. Khan; A. Roy; M. M. Rahman; S. H. Mukta; A. K. M. Najmul Islam,"Military Institute of Science &amp; Technology,Dept. of Computer Science & Engineering,Dhaka,Bangladesh; Military Institute of Science &amp; Technology,Dept. of Computer Science & Engineering,Dhaka,Bangladesh; Military Institute of Science &amp; Technology,Dept. of Computer Science & Engineering,Dhaka,Bangladesh; Military Institute of Science &amp; Technology,Dept. of Computer Science & Engineering,Dhaka,Bangladesh; United International University,Dept. of Computer Science & Engineering,Dhaka,Bangladesh; LUT School of Engineering,Dept. of Computer Science & Engineering,Lappeenranta,Finland",Publication Title,Publication Title
A Novel Ensemble Machine Learning and an Evolutionary Algorithm in Modeling the COVID-19 Epidemic and Optimizing Government Policies,M. -H. Tayarani-Najaran,"School of Computer Science, University of Hertfordshire, Hatfield AL10 9AB, U.K. (e-mail: tayaranm@herts.ac.uk)",Publication Title,Publication Title
Comparative Study of Forecasting Models for COVID-19 Outbreak in Turkey,M. Nakip; O. Çopur; C. Güzeliş,"Institute of Theoretical and Applied Informatics, Polish Academy of Sciences,Gliwice,Poland; Sapienza Universiy of Rome,Department of Statistics,Rome,Italy; Yaşar University,Dept. of Electrical-Electronics Engineering,Izmir,Turkey",Publication Title,Publication Title
Convolutional Neural Network for Covid-19 detection from X-ray images,A. Jain; S. Ratnoo; D. Kumar,"Guru Jambheshwar University of Science and Technology,Dept. of Computer Science & Engineering,Hisar,Haryana,India; Guru Jambheshwar University of Science and Technology,Dept. of Computer Science & Engineering,Hisar,Haryana,India; Delhi Technological University,Dept. of Electronics Computing & Engineering,Daulatpur,Delhi,India",Publication Title,Publication Title
Detection COVID-19 using Machine Learning from Blood Tests,N. Hany; N. Atef; N. Mostafa; S. Mohamed; M. ElSahhar; A. AbdelRaouf,"Misr International University,Cairo,Egypt; Misr International University,Cairo,Egypt; Misr International University,Cairo,Egypt; Misr International University,Cairo,Egypt; Misr International University,Cairo,Egypt; Misr International University,Cairo,Egypt",Publication Title,Publication Title
Detection Capability Prediction Based on Broad Learning System during the COVID-19 Pandemic,J. Lin; M. Tan; Y. Zheng; K. Wu; C. Zhan,"School of Electrical and Computer Engineering Nanfang College &#x00B7; Guangzhou,Guangzhou,China; School of Electrical and Computer Engineering Nanfang College &#x00B7; Guangzhou,Guangzhou,China; School of Electrical and Computer Engineering Nanfang College &#x00B7; Guangzhou,Guangzhou,China; School of Electrical and Computer Engineering Nanfang College &#x00B7; Guangzhou,Guangzhou,China; School of Electrical and Computer Engineering Nanfang College &#x00B7; Guangzhou,Guangzhou,China",Publication Title,Publication Title
My Mind is a Prison: A Boosted Deep Learning approach to detect the rise in depression since COVID-19 using a stacked bi-LSTM CatBoost model,S. Nandy; V. Kumar,"National Institute of Technology, Warangal,Electrical and Electronics Engineering,Warangal,India; Manipal Institute of Technology,Information and Communication Technology,Manipal,India",Publication Title,Publication Title
Random-Forest-Bagging Broad Learning System With Applications for COVID-19 Pandemic,C. Zhan; Y. Zheng; H. Zhang; Q. Wen,"School of Electronical and Computer Engineering, Nanfang College of Sun Yat-sen University, Guangzhou, China; School of Electronical and Computer Engineering, Nanfang College of Sun Yat-sen University, Guangzhou, China; Shenzhen Graduate School, Harbin Institute of Technology, Shenzhen, China; School of Computer Science and Engineering, South China University of Technology, Guangzhou, China",Publication Title,Publication Title
Predicting COVID-19 Spread Level using Socio- Economic Indicators and Machine Learning Techniques,A. Mihoub; H. Snoun; M. Krichen; R. B. H. Salah; M. Kahia,"Information System and Production Management, College of Business and Economics, Qassim University,Department of Management,Buraidah,Saudi Arabia,51452; Modeling in Hydraulics & Environment Labratory National Engineering, School of Tunis Campus universitaire,Departement of Civil Engineering,Bélvédére,Tunis,Tunisia,1002; ReDCAD Laboratory, University of Sfax,Tunisia; STC Solutions,Department of Digital Transformation,Riyadh,Saudi Arabia,12641; College of Business and Economics, Qassim University, LAREQUAD & FSEGT, University of Tunis El Manar, Tunisia,Department of Finance & Economics,Buraidah,Saudi Arabia,51452",Publication Title,Publication Title
COVID-19 Screening Using Residual Attention Network an Artificial Intelligence Approach,V. Sharma; C. Dyreson,"Utah State University,Department of Computer Science,Utah,USA; Utah State University,Department of Computer Science,Utah,USA",Publication Title,Publication Title
Mapping Health Trajectories on Self Organizing Maps using COVID-19 Patient’s Blood Tests,C. Arias-Alcaide; C. Soguero-Ruiz; P. Santos-Alvarez; A. García-Romero; I. Mora-Jiménez,"Universidad Rey Juan Carlos,Dept Signal Theory and Communications,Madrid,Spain; Universidad Rey Juan Carlos,Dept Signal Theory and Communications,Madrid,Spain; Hospital Universitario del Sureste,Hospital Assistance Director,Madrid,Spain; Hospital Universitario del Sureste,Hospital Assistance Director,Madrid,Spain; Hospital Universitario del Sureste,Dept Management Control,Madrid,Spain",Publication Title,Publication Title
Smart Gateway Screening for Covid-19,A. Ansari; M. Ansari; Y. Mehta; S. Jadhav,"Vidyavardhni's College of Engineering and Technology,Electronics and Telecommunication Engineering,Mumbai,India; Vidyavardhini's College of Engineering and Technology,Electronics and Telecommunication Engineering,Mumbai,India; Vidyavardhini's College of Engineering and Technology,Electronics and Telecommunication Engineering,Mumbai,India; Vidyavardhini's College of Engg.,Dept. of Electronics & Telecommunication Engineering,Mumbai,India",Publication Title,Publication Title
Comorbidity Impact on COVID-19,N. Darapaneni; M. Arul; A. R. Paduri; V. Meenakshisundaram; P. Srinivasan; N. Joseph; D. Sharma,"Great Learning/Northwestern University,AIML,Illinois,USA; Great Learning,AIML,Chennai,India; Great Learning,AIML,Mumbai,India; Great Learning,AIML,Chennai,India; Great Learning,AIML,Chennai,India; Great Learning,AIML,Chennai,India; Great Learning,AIML,Chennai,India",Publication Title,Publication Title
A Novel Approach in Credit Card Fraud Detection System Using Machine Learning Techniques,G. M. Suhas Jain; N. Rakesh; K. Pranavi; L. Bale,"BMS Institute of Technology and Management,Department of Artificial Intelligence and Machine Learning,Bengaluru,Karnataka; BMS Institute of Technology and Management,Department of Artificial Intelligence and Machine Learning,Bengaluru,Karnataka; BMS Institute of Technology and Management,Department of Artificial Intelligence and Machine Learning,Bengaluru,Karnataka; BMS Institute of Technology and Management,Department of Artificial Intelligence and Machine Learning,Bengaluru,Karnataka",Publication Title,Publication Title
Covid Prediction and Covid Detection via X-Ray Images,V. Chauhan; P. Johri; P. Singh; A. P; S. Gupta,"Dr Akhilesh Das Gupta Institute of Technology &#x0026; Management,Department of Computer Science &#x0026; Engineering,New Delhi,India; Galgotia University, Gr Noida, India Galgotia University,School of Computing Sciences and Engineering,Gr Noida,India; Dr Akhilesh Das Gupta Institute of Technology &#x0026; Management,Department of Information Technology,New Delhi,India; Dr Akhilesh Das Gupta Institute of Technology &#x0026; Management,Department of Computer Science &#x0026; Engineering,New Delhi,India; Dr Akhilesh Das Gupta Institute of Technology &#x0026; Management,Department of Computer Science &#x0026; Engineering,New Delhi,India",Publication Title,Publication Title
Using Reinforcement Learning Algorithms to Explore COVID-19 Spread in South Africa,R. L. Hanie; J. J. van Rensburg,"School of Computer Science and Information Systems, North-West university,Vanderbijlpark,South Africa; School of Computer Science and Information Systems, North-West university,Vanderbijlpark,South Africa",Publication Title,Publication Title
A Diagnostic Study on Prediction of Covid-19 by Symptoms Using Machine Learning,E. A. Devi; V. Athappan; R. R. Rajendran; E. A. Devi; G. Emayavaramban; S. Sriragavi; M. Sivaramkrishnan,"Sathyabama Institute of Science and Technology,Assistant Professor, Department of ECE,Chennai,India,600119; Kumaraguru College of Technology,Assistant Professor-II, Department of EIE,Coimbatore,India,641049; Lehigh University,Research Scholar, Department of Mechanical Engineering and Mechanics,Bethlehem,PA,USA,18015; St. Joseph&#x2019;s College of Engineering,Assistant Professor, Department of ICE,Chennai,India,600119; Karpagam Academy of Higher Education,Assistant Professor, Department of EEE,India; Karpagam Academy of Higher Education,Research Scholar, Department of EEE,India; Karpagam College of Engineering,Assistant Professor, Dept of EEE,India",Publication Title,Publication Title
CNN Architecture Comparison for Covid-19 Image Classification Process,H. M. Ramadhani; A. P. Pratiwi; S. C. Hidayati; D. Herumurti,"Institut Teknologi Sepuluh Nopember,Department of Informatics,Surabaya,Indonesia; Institut Teknologi Sepuluh Nopember,Department of Informatics,Surabaya,Indonesia; Institut Teknologi Sepuluh Nopember,Department of Informatics,Surabaya,Indonesia; Institut Teknologi Sepuluh Nopember,Department of Informatics,Surabaya,Indonesia",Publication Title,Publication Title
A Machine Learning-Based Privacy-Preserving Model for COVID-19 Patient using Differential Privacy,R. K. Dewang; A. Raven; A. Mewada,"Motilal Nehru National Institute of Technology, Allahabad,CSE Department,Prayagraj,India; Motilal Nehru National Institute of Technology, Allahabad,CSE Department,Prayagraj,India; Motilal Nehru National Institute of Technology, Allahabad,CSE Department,Prayagraj,India",Publication Title,Publication Title
Derivation of a Cost-Sensitive COVID-19 Mortality Risk Indicator Using a Multistart Framework,R. Armañanzas; A. Díaz; M. Martínez-García; S. Mazuelas,"Data Science Area Basque Center for Applied Mathematics,Bilbao,Spain; Data Science Area Basque Center for Applied Mathematics,Bilbao,Spain; Data Science Area Basque Center for Applied Mathematics,Bilbao,Spain; Data Science Area Basque Center for Applied Mathematics IKERBASQUE Basque Foundation for Science,Bilbao,Spain",Publication Title,Publication Title
Forecasting & Severity Analysis of COVID-19 Using Machine Learning Approach with Advanced Data Visualization,O. Sarkar; M. F. Ahamed; P. Chowdhury,"Rajshahi University of Engineering & Technology,Electrical & Computer Engineering,Rajshahi,Bangladesh,6204; Rajshahi University of Engineering & Technology,Electrical & Computer Engineering,Rajshahi,Bangladesh,6204; Rajshahi University of Engineering & Technology,Electrical & Computer Engineering,Rajshahi,Bangladesh,6204",Publication Title,Publication Title
Modified Machine Learning Techique for Curve Fitting on Regression Models for COVID-19 projections,A. Andreas; C. X. Mavromoustakis; G. Mastorakis; S. Mumtaz; J. M. Batalla; E. Pallis,"University of Nicosia and University of Nicosia Research Foundation,Department of Computer Science,Nicosia,Cyprus; University of Nicosia and University of Nicosia Research Foundation,Department of Computer Science,Nicosia,Cyprus; Hellenic Mediterranean University,Department of Management Science and Technology,Agios Nikolaos,Crete,Greece; Instituto de Telecomunicações,Aveiro,Portugal; Warsaw University of Technology and National Institute of Telecommunications,Warsaw,Poland; Hellenic Mediterranean University,Department of Electrical and Computer Engineering,Heraklion,Crete,Greece",Publication Title,Publication Title
A Machine Learning Approach to Track COVID-19 Pandemic using Sentiment Analysis,T. Rahman; S. Aktar,"Rajshahi University of Engineering and Technology,Department of Computer Science and Engineering,Rajshahi-6204,Bangladesh; Bangabandhu Sheikh Mujibur Rahman Science and Technology University,Department of Computer Science and Engineering,Gopalganj-8100,Bangladesh",Publication Title,Publication Title
Importance of Artificial Intelligence and Machine Learning in fighting with COVID-19 Epidemic,V. Solanki; U. Solanki; A. Baliyan; V. Kukreja; V. Lamba; B. Kumar Sahoo,"Chitkara University,Chitkara University Institute of Engineering and Technology,Punjab,India; Manipal University Jaipur,TAPMI School of Business,Jaipur,Rajastan,India; Chitkara University,Chitkara University Institute of Engineering and Technology,Punjab,India; Chitkara University,Chitkara University Institute of Engineering and Technology,Punjab,India; Chitkara University,Chitkara University Institute of Engineering and Technology,Punjab,India; Chitkara University,Chitkara University Institute of Engineering and Technology,Punjab,India",Publication Title,Publication Title
Computer Audition for Fighting the SARS-CoV-2 Corona Crisis—Introducing the Multitask Speech Corpus for COVID-19,K. Qian; M. Schmitt; H. Zheng; T. Koike; J. Han; J. Liu; W. Ji; J. Duan; M. Song; Z. Yang; Z. Ren; S. Liu; Z. Zhang; Y. Yamamoto; B. W. Schuller,"Educational Physiology Laboratory, Graduate School of Education, The University of Tokyo, Tokyo, Japan; Chair of Embedded Intelligence for Health Care and Wellbeing, University of Augsburg, Augsburg, Germany; Department of Hand Surgery, Wuhan Union Hospital, Tongji Medical College, Huazhong University of Science and Technology, Wuhan, China; Educational Physiology Laboratory, Graduate School of Education, The University of Tokyo, Tokyo, Japan; Mobile Systems Group, University of Cambridge, Cambridge, U.K.; Department of Plastic Surgery, Central Hospital of Wuhan, Tongji Medical College, Huazhong University of Science and Technology, Wuhan, China; Department of Plastic Surgery, Wuhan Third Hospital and Tongren Hospital of Wuhan University, Wuhan, China; Department of Plastic Surgery, Central Hospital of Wuhan, Tongji Medical College, Huazhong University of Science and Technology, Wuhan, China; Chair of Embedded Intelligence for Health Care and Wellbeing, University of Augsburg, Augsburg, Germany; Chair of Embedded Intelligence for Health Care and Wellbeing, University of Augsburg, Augsburg, Germany; Chair of Embedded Intelligence for Health Care and Wellbeing, University of Augsburg, Augsburg, Germany; Chair of Embedded Intelligence for Health Care and Wellbeing, University of Augsburg, Augsburg, Germany; GLAM—the Group on Language, Audio, and Music, Imperial College London, London, U.K.; Educational Physiology Laboratory, Graduate School of Education, The University of Tokyo, Tokyo, Japan; Chair of Embedded Intelligence for Health Care and Wellbeing, University of Augsburg, Augsburg, Germany",Publication Title,Publication Title
Prediction of COVID-19 Cases in Malaysia by Using Machine Learning: A Preliminary Testing,A. N. Akramin Kamarudin; Z. Zainol; N. F. Abu Kassim; R. Sharif,"School of Computer Science, Universiti Sains Malaysia,Georgetown,Malaysia; School of Computer Science, Universiti Sains Malaysia,Georgetown,Malaysia; School of Biological Science, Universiti Sains Malaysia,Georgetown,Malaysia; Universiti Kebangsaan Malaysia,Faculty of Health Science,Kuala Lumpur,Malaysia",Publication Title,Publication Title
COVID-19 Diagnosis at Early Stage Based on Smartwatches and Machine Learning Techniques,J. Skibinska; R. Burget; A. Channa; N. Popescu; Y. Koucheryavy,"FEEC, Brno University of Technology, Brno, Czech Republic; FEEC, Brno University of Technology, Brno, Czech Republic; Computer Science Department, University POLITEHNICA of Bucharest, Bucharest, Romania; Computer Science Department, University POLITEHNICA of Bucharest, Bucharest, Romania; Unit of Electrical Engineering, Tampere University, Tampere, Finland",Publication Title,Publication Title
Bitcoin price prediction in the time of COVID-19,J. Luo,"University of California-Los Angeles,Department of Statistics,Los Angeles,USA,90024",Publication Title,Publication Title
Forecasting the COVID-19 Pandemic in Bangladesh Using ARIMA Model,J. A. Ratu; M. A. Masud; M. M. Hossain; M. Samsuzzaman,"Patuakhali Science and Technology University,Faculty of Computer Science and Engineering,Bangladesh; Patuakhali Science and Technology University,Department of Computer Science and Information Technology,Bangladesh; Patuakhali Science and Technology University,Faculty of Computer Science and Engineering,Bangladesh; Patuakhali Science and Technology University,Department of Computer and Communication Engineering,Bangladesh",Publication Title,Publication Title
Information technology platform for the selection and analytical processing of information on COVID-19,O. Duda; N. Kunanets; S. Martsenko; V. Nykytyuk; V. Pasichnyk,"Ternopil Ivan Puluj National Technical University,Department of Computer Science,Ternopil,Ukraine; Lviv Polytechnic National University,Department of Information Systems and Networks,Lviv,Ukraine; Ternopil Ivan Puluj National Technical University,Department of Computer Science,Ternopil,Ukraine; Ternopil Ivan Puluj National Technical University,Department of Computer Science,Ternopil,Ukraine; Lviv Polytechnic National University,Department of Information Systems and Networks,Lviv,Ukraine",Publication Title,Publication Title
A Physician Assisting COVID-19 Diagnosis System to Categorize Positive Cases using Radiology Images,B. Gopinath; S. A. Kumar; S. Sasikala,"Kumaraguru College of Technology,Department of Electronics and Communication Engineering,Coimbatore,India; Kumaraguru College of Technology,Department of Electronics and Communication Engineering,Coimbatore,India; Kumaraguru College of Technology,Department of Electronics and Communication Engineering,Coimbatore,India",Publication Title,Publication Title
The COVID-19 Pandemic Prediction in the US Based on Machine Learning,W. Zou,"Shandong University (Weihai),School of Mechanical, Electrical and Information Engineering,Weihai,China,264209",Publication Title,Publication Title
An Advanced Machine Learning Algorithm For Intensive Care Decisions Of COVID-19 Patients,K. Zhao; K. Qi; D. Che; M. Y. Shalaginov; T. Helen Zeng; M. Pugach-Gordon,"Class 2022, Lexington High School,Lexington,MA,U.S.A.; Carroll School of Management, Boston College,Chestnut Hill,MA,U.S. A; Academy for Advanced Research and Development,Cambridge,U.S.A.; MIT,Department of MSE,Cambridge,U.S.A.; The Forsyth Institute; Academy for Advanced Research and Development,Cambridge,MA,U.S.A.",Publication Title,Publication Title
AI-Enabled Covid-19 Prediction Methods and Anti-Covid Strategies,A. Chitturi; R. J. Pandya; S. Iyer,"Indian Institute of Technology,Dept. of Electrical Engineering,Dharwad,India; Indian Institute of Technology,Dept. of Electrical Engineering,Dharwad,India; KLE MS Sheshgiri Col.of Eng.&#x0026; Tech.,Dept. of ECE,Belagavi,India",Publication Title,Publication Title
Prediction of Length of Stay in the Emergency Department for COVID-19 Patients: A Machine Learning Approach,E. -E. Etu; L. Monplaisir; S. Arslanturk; S. Masoud; C. Aguwa; I. Markevych; J. Miller,"Department of Industrial and Systems Engineering, Wayne State University, Detroit, MI, USA; Department of Industrial and Systems Engineering, Wayne State University, Detroit, MI, USA; Department of Computer Science, Wayne State University, Detroit, MI, USA; Department of Industrial and Systems Engineering, Wayne State University, Detroit, MI, USA; Department of Industrial and Systems Engineering, Wayne State University, Detroit, MI, USA; School of Computer Science, Carnegie Mellon University, Pittsburgh, PA, USA; Departments of Emergency Medicine and Internal Medicine, Henry Ford Hospital, Detroit, MI, USA",Publication Title,Publication Title
A Sentiment Analysis Framework on COVID-19 in Major Cities of Malaysia based on Tweets using Machine Learning Classification Model,R. Aminuddin; M. A. Bistamam; S. Ibrahim; N. N. Abu Mangshor; S. F. A. Fesol; N. I. F. A. Wahab,"Universiti Teknologi MARA,Faculty of Computer and Mathematical Sciences,Malacca,Malaysia; Universiti Teknologi MARA,Faculty of Computer and Mathematical Sciences,Malacca,Malaysia; Universiti Teknologi MARA,Faculty of Computer and Mathematical Sciences,Malacca,Malaysia; Universiti Teknologi MARA,Faculty of Computer and Mathematical Sciences,Malacca,Malaysia; Universiti Teknologi MARA,Faculty of Computer and Mathematical Sciences,Malacca,Malaysia; CogDev Malaysia Sdn Bhd,Department of Information Technology,Cyberjaya,Malaysia",Publication Title,Publication Title
Mining Concepts for a COVID Interface Terminology for Annotation of EHRs,V. K. Keloth; S. Zhou; L. Lindemann; G. Elhanan; A. J. Einstein; J. Geller; Y. Perl,"New Jersey Institute of Technology,Department of Computer Science,Newark,NJ,USA; New Jersey Institute of Technology,Department of Computer Science,Newark,NJ,USA; Yale University,Yale Center for Medical Informatics,New Haven,CT,USA; Desert Research Institute,Renown Institute for Health Innovation,Reno,NV,USA; Columbia University Irving Medical Center,Dept. of Medicine, Cardiology Division, and Dept. of Radiology,New York,NY,USA; New Jersey Institute of Technology,Department of Computer Science,Newark,NJ,USA; New Jersey Institute of Technology,Department of Computer Science,Newark,NJ,USA",Publication Title,Publication Title
Elastic Net to Forecast COVID-19 Cases,T. K. Johnsen; J. Z. Gao,"San Jose State Univeristy,Applied Data Science,San Jose,CA,USA; Computer Engineering San Jose State University,San Jose,CA,USA",Publication Title,Publication Title
Economic Inclusion in the United States: Predictive Analysis of COVID-19 pandemic on County Rates of Unbanked Households,T. Berdibekov; P. R. Pasnoor; A. R. Annamaneni; E. N. Ceesay,"George Mason University,Fairfax,United States; George Mason University,Fairfax,United States; George Mason University,Fairfax,United States; George Mason University,Fairfax,United States",Publication Title,Publication Title
Analyzing the impact of COVID-19 on flight cancellation using machine learning and deep learning algorithms for a highly unbalanced dataset,Z. Mohammed; M. Asghar; N. Kanwal,"Technological University of the Shannon: Midlands Midwest,Software Research Institute,Athlone,Ireland; Technological University of the Shannon: Midlands Midwest,Software Research Institute,Athlone,Ireland; Keele University,Software Research Institute, Technological University of the Shannon: Midlands Midwest, School of Computing and Mathematics,Athlone,Keele,Ireland, UK",Publication Title,Publication Title
Few-Shot Learning Approach for COVID-19 Detection from X-Ray Images,R. Abdrakhmanov; M. Altynbekov; A. Abu; A. Shomanov; D. Viderman; M. -H. Lee,"Nazarbayev University,School of Engineering and Digital Sciences,Nur-Sultan,Kazakhstan; Nazarbayev University,School of Engineering and Digital Sciences,Nur-Sultan,Kazakhstan; Nazarbayev University,School of Engineering and Digital Sciences,Nur-Sultan,Kazakhstan; Nazarbayev University,School of Engineering and Digital Sciences,Nur-Sultan,Kazakhstan; Nazarbayev Univeristy,School of Medicine,Nur-Sultan,Kazakhstan; Nazarbayev University,School of Engineering and Digital Sciences,Nur-Sultan,Kazakhstan",Publication Title,Publication Title
COVID-19 Social Distance Proximity Estimation Using Machine Learning Analyses of Smartphone Sensor Data,O. Semenov; E. Agu; K. Pahlavan; Z. Su,"Department of Electrical and Computer Engineering, Worcester Polytechnic Institute, Worcester, MA, USA; Department of Electrical and Computer Engineering, Worcester Polytechnic Institute, Worcester, MA, USA; Department of Electrical and Computer Engineering, Worcester Polytechnic Institute, Worcester, MA, USA; Department of Electrical and Computer Engineering, Worcester Polytechnic Institute, Worcester, MA, USA",Publication Title,Publication Title
Machine Learning based Identification of Covid-19 Future Forecasting,P. Anitha; P. R. Kumar; S. Surya; R. Santhiya,"CSE, Sri Krishna College of Engineering and Technology,India; CSE, Sri Krishna College of Engineering and Technology,India; CSE, Sri Krishna College of Engineering and Technology,India; CSE, Sri Krishna College of Engineering and Technology,India",Publication Title,Publication Title
In Silico Prediction of Indonesian Herbs Compounds as Covid-19 Supportive Therapy using Support Vector Machine,M. D. Darma; M. Reza Faisal; I. Budiman; R. Herteno; J. P. Utami; B. Abapihi,"Lambung Mangkurat University,Department of Computer Science,Banjarbaru,Indonesia; Lambung Mangkurat University,Department of Computer Science,Banjarbaru,Indonesia; Lambung Mangkurat University,Department of Computer Science,Banjarbaru,Indonesia; Lambung Mangkurat University,Department of Computer Science,Banjarbaru,Indonesia; Lambung Mangkurat University,Department of Dentistry,Banjarmasin,Indonesia; Halu Oleo University,Department of Statistics,Kendari,Indonesia",Publication Title,Publication Title
A Survey for Using AI Techniques for Predicting COVID-19,H. A. Aldabagh; G. A. Altalib,"University of Mosul,Dept. Computer Science,Mosul,Iraq; University of Mosul,Dept. Computer Science,Mosul,Iraq",Publication Title,Publication Title
