Document Title,Authors,Author Affiliations,Publication Title,Publication Title
Global COVID-19 development trend forecast based on machine learning,Y. Cheng; Y. Bai; T. Xu; H. Hu,"North University of China,School of Sciences,Taiyuan,China,030051; North University of China,School of Sciences,Taiyuan,China,030051; North University of China,School of Sciences,Taiyuan,China,030051; North University of China,School of Sciences,Taiyuan,China,030051",Publication Title,Publication Title
A Review of the Machine Learning Algorithms for Covid-19 Case Analysis,S. Tiwari; P. Chanak; S. K. Singh,"Computer Science & Engineering, Indian Institute of Technology BHU Varanasi, 79203 Varanasi, Uttar Pradesh, India, 221005 (e-mail: shrikanttiwari15@gmail.com); Computer Science & Engineering, Indian Institute of Technology BHU Varanasi, 79203 Varanasi, Uttar Pradesh, India, (e-mail: prasenjit.cse@iitbhu.ac.in); Computer Science & Engineering, Indian Institute of Technology BHU Varanasi, 79203 Varanasi, Uttar Pradesh, India, (e-mail: sks.cse@iitbhu.ac.in)",Publication Title,Publication Title
Predicting COVID-19 Severe Patients and Evaluation Method of 3 Stages Severe Level by Machine Learning,J. Qu; B. Sumali; Y. Mitsukura,"Keio University,School of Integrated Design Engineering,Yokohama,Kanagawa,Japan; Keio University,School of Integrated Design Engineering,Yokohama,Kanagawa,Japan; Keio University,School of Integrated Design Engineering,Yokohama,Kanagawa,Japan",Publication Title,Publication Title
Machine Learning based COVID-19 Cough Classification Models - A Comparative Analysis,J. Vrindavanam; R. Srinath; H. H. Shankar; G. Nagesh,"Nitte Meenakshi Institute of Technology,Dept. of ECE,Bengaluru,India; Graylinx Pvt Ltd,Bengaluru,India; Nitte Meenakshi Institute of Technology,Dept. of ECE,Bengaluru,India; Nitte Meenakshi Institute of Technology,Dept. of ECE,Bengaluru,India",Publication Title,Publication Title
Analysis and Prediction of COVID-19 in Xinjiang Based on Machine Learning,Y. Liu; Y. Xiao,"Shanghai Institute of Technology SIT,Shanghai,China; Shanghai Institute of Technology SIT,Shanghai,China",Publication Title,Publication Title
COVID-19 Patient Mortality Risk Classification Using Linear Regression and Exponential Smoothing Methods,M. S. Anggreainy; H. Musyaffa; A. M. Illyasu,"Bina Nusantara University,School of Computer Science,Computer Science Department,Jakarta,Indonesia,11480; Bina Nusantara University,School of Computer Science,Computer Science Department,Jakarta,Indonesia,11480; Tokyo Institute of Technology,School of Computing,Yokohama,Japan,226-8502",Publication Title,Publication Title
Comparative Intrepretation Of Machine Learning Algorithms In Predicting The Cardiovascular Death Rate For Covid-19 Data,D. R. Krithika; K. Rohini,"Vels Institute of Science Technology and Advanced Studies,Department of Computer Science,Chennai,India; Vels Institute of Science Technology and Advanced Studies,Department of Computer Science,Chennai,India",Publication Title,Publication Title
The Effect of World Happiness Aspects with COVID-19 Infected using Machine Learning Multiple Regression Model,R. Setiawan; Z. E. Rasjid; A. Effendi,"Bina Nusantara University,School of Computer Science,Computer Science Department,Jakarta,Indonesia,11480; Bina Nusantara University,School of Computer Science,Computer Science Department,Jakarta,Indonesia,11480; Bina Nusantara University,School of Information System,Information Systems Department,Jakarta,Indonesia,11480",Publication Title,Publication Title
Machine Learning Performances for Covid-19 Images Classification based Histogram of Oriented Gradients Features,Y. Jusman; W. Tyassari; D. Nisrina; F. G. Santosa; N. A. Prayitno,"Universitas Muhammadiyah Yogyakarta,Faculty of Engineering,Department of Electrical Engineering,Yogyakarta,Indonesia; Universitas Muhammadiyah Yogyakarta,Faculty of Engineering,Department of Electrical Engineering,Yogyakarta,Indonesia; Universitas Muhammadiyah Yogyakarta,Faculty of Engineering,Department of Electrical Engineering,Yogyakarta,Indonesia; Universitas Muhammadiyah Yogyakarta,Faculty of Engineering,Department of Electrical Engineering,Yogyakarta,Indonesia; Universitas Muhammadiyah Yogyakarta,Faculty of Engineering,Department of Electrical Engineering,Yogyakarta,Indonesia",Publication Title,Publication Title
Covid-19 Data Analysis using Machine Learning,A. Bhardwaj; N. Natarajan,"Galgotias College of Engineering and Technology,Greater Noida,UP; National Informatics Centre,Delhi",Publication Title,Publication Title
Performance Analysis of Machine Learning Algorithms in Detection of COVID-19 from Common Symptoms,H. Arslan; B. Aygün,"Ankara Yıldırım Beyazıt University,Department of Software Engineering,Ankara,Turkey; İzmir Democracy University,Department of Management Information Systems,İzmir,Turkey",Publication Title,Publication Title
Comparing Traditional Machine Learning Methods for COVID-19 Fake News,S. Almatarneh; P. Gamallo; B. ALshargabi; Y. Al-Khassawneh; R. Alzubi,"Zarqa University,Faculty of Information Technology,Alzarqa,Jordan; Universidade de Santiago de Compostela,CiTIUS,Galiza,Spain; Middle East University,Faculty of Information Technology,Amman,Jordan; Zarqa University,Faculty of Information Technology,Alzarqa,Jordan; King Faisal University,Department of Computer Science,Hofuf,Saudi Arabia",Publication Title,Publication Title
Predicting the Probability of Covid-19 Recovered in South Asian Countries Based on Healthy Diet Pattern Using a Machine Learning Approach,M. S. Hossen; D. Karmoker,"Faculty of Computer Science and Engineering Patuakhali Science and Technology University,Patuakhali,Bangladesh; Faculty of Computer Science and Engineering Patuakhali Science and Technology University,Patuakhali,Bangladesh",Publication Title,Publication Title
Machine Learning Algorithms for Predicting SARS-CoV-2 (COVID-19) – A Comparative Analysis,L. W. Mary; S. A. A. Raj,"SRM Institute of Science and Technology,Department of Computer Applications,Kattankulathur, Chennai,India; SRM Institute of Science and Technology,Department of Computer Applications,Kattankulathur, Chennai,India",Publication Title,Publication Title
Time series Covid 19 Predictions with Machine Learning Models,J. V,"CMR Institute of Technology,Department of CSE,Bengaluru,India",Publication Title,Publication Title
Digital Screening Tool to Detect Covid-19 Infected People,J. E. Nalavade,"Pillai HOC College of Engineering and Technology,Department of Information Technology,Raigad,India",Publication Title,Publication Title
A Comparative Study of Machine Learning Approaches for Rumors Detection in Covid-19 Tweets,N. Ashraf; H. Nayel; M. Taha,"Benha University,Department of Computer Science,Benha,Egypt; Benha University,Department of Computer Science,Benha,Egypt; Benha University,Department of Computer Science,Benha,Egypt",Publication Title,Publication Title
Machine Learning to Predict COVID-19 and ICU Requirement,P. Podder; M. R. H. Mondal,"Bangladesh University of Engineering and Technology (BUET),Institute of Information and Communication Technology,Dhaka,Bangladesh,1205; Bangladesh University of Engineering and Technology (BUET),Institute of Information and Communication Technology,Dhaka,Bangladesh,1205",Publication Title,Publication Title
COVID Detection using X-Ray images through Machine Learning,D. Puri; K. Chauhan; P. Chauhan; A. Gupta,"Chandigah University,AIT-CSE,Mohali,Punjab,India; Chandigah University,CSE,Mohali,Punjab,India; APG Shimla University,Shimla,Himachal Pradesh,India; ABVGIET,Shimla,Himachal Pradesh,India",Publication Title,Publication Title
COVID-19 X-ray Prediction Using Machine Learning Models,Y. Hou; Z. Zhai; Y. Zhang; J. Zou,"University of Colorado Boulder,College of Engineering & Applied Science,Boulder,USA; Hong Kong Baptist University,Computer Science Department,Hong Kong,China; Xi'an JiaoTong University,School of Electrical and Electronic Engineering,Xi'an,Shanxi; SouthWest University,College of Computer & Information Science,Chongqing,China",Publication Title,Publication Title
Machine Learning Classification of X-RAY of the Diagnosis of Covid-19,P. Mittal; A. Maggu; K. Malhotra; Yogesh,"Amity University,Information Technology Amity School of Engineering &#x0026; Technology,Noida,Uttar Pradesh,India,201301; Amity University,Information Technology Amity School of Engineering &#x0026; Technology,Noida,Uttar Pradesh,India,201301; Amity University,Information Technology Amity School of Engineering &#x0026; Technology,Noida,Uttar Pradesh,India,201301; Amity University,Information Technology Amity School of Engineering &#x0026; Technology,Noida,Uttar Pradesh,India,201301",Publication Title,Publication Title
Twitter Data Analysis Using Machine Learning To Evaluate Community Compliance in Preventing the Spread of Covid-19,N. S. Wibowo; R. Mahardika; K. Kusrini,"Universitas AMIKOM Yogyakarta,Magister of Informatics,Yogyakarta,Indonesia; Universitas AMIKOM Yogyakarta,Magister of Informatics,Yogyakarta,Indonesia; Universitas AMIKOM Yogyakarta,Magister of Informatics,Yogyakarta,Indonesia",Publication Title,Publication Title
Predictions of COVID-19 Infection Severity Based on Co-associations between the SNPs of Co-morbid Diseases and COVID-19 through Machine Learning of Genetic Data,R. Y. Wang; T. Q. Guo; L. G. Li; J. Y. Jiao; L. Y. Wang,"Shanghai American School,Shanghai,China; Shanghai United International School,Shanghai,China; University of Illinois at Urbana-Champaign,Champaign,United States; Tianjin No.1 High School,Tianjin,China; Shanghai American School,Shanghai,China",Publication Title,Publication Title
Predicting the influence of Covid-19 on GDP with ensembled machine learning models,Y. Wu; Y. Yang; Y. Wu; Y. Boshuai,"Hainan University,Haikou,China; University of Electronic Science and Technology of China,Chengdu,China; University of Exeter,Exeter,England; Nanjing Institute of Technology,Nanjing,China",Publication Title,Publication Title
Real-time estimation of COVID-19 cases using machine learning and mathematical models - The case of India,P. Kumari; D. Toshniwal,"Indian Institute of Technology,Department of Computer Science & Engineering,Roorkee,India; Indian Institute of Technology,Department of Computer Science & Engineering,Roorkee,India",Publication Title,Publication Title
A Survey of Machine Learning Technologies for COVID-19 Pandemic,Q. An; Q. Gao; Z. Gao; Y. Qian,"Nanjing University of Posts and Telecommunications,Bell Honor School,Nanjing,China; University of Washington,College of Engineering,Seattle,United States; Nanjing University of Posts and Telecommunications,Bell Honor School,Nanjing,China; Nanjing University of Posts and Telecommunications,Bell Honor School,Nanjing,China",Publication Title,Publication Title
Novel COVID-19 Screening Using Cough Recordings of A Mobile Patient Monitoring System,X. Zhang; M. Pettinati; A. Jalali; K. S. Rajput; N. Selvaraj,"Biofourmis Inc,Boston,MA,USA,02110; Biofourmis Inc,Boston,MA,USA,02110; Biofourmis Inc,Boston,MA,USA,02110; Biofourmis Inc,Boston,MA,USA,02110; Biofourmis Inc,Boston,MA,USA,02110",Publication Title,Publication Title
Future Prediction of COVID-19 based on Supervised Machine Learning Models,V. Vaishnavi; S. Samyuktha; V. M. Ravali; P. Sarayu; B. V. Kumar,"PVPSIT - Vijayawada,Dept of CSE,Andhra Pradhesh,India; PVPSIT - Vijayawada,Dept of CSE,Andhra Pradhesh,India; PVPSIT - Vijayawada,Dept of CSE,Andhra Pradhesh,India; PVPSIT - Vijayawada,Dept of CSE,Andhra Pradhesh,India; PVPSIT - Vijayawada,Dept of CSE,Andhra Pradhesh,India",Publication Title,Publication Title
Parameter Based Literature Survey of COVID-19 Mortality Dynamics Using Machine Learning Techniques,M. Sewariya; R. Katarya,"Delhi Technical University,Big Data Analytics and Web Intelligence Laboratory,Department of Computer Science,New Delhi,India; Delhi Technical University,Big Data Analytics and Web Intelligence Laboratory,Department of Computer Science,New Delhi,India",Publication Title,Publication Title
Global Prediction of COVID-19 Cases and Deaths using Machine Learning,S. Bhardwaj; H. Bhardwaj; J. Bhardwaj; P. Gupta,"Amity University,Noida,Uttar Pradesh; Amity University,Noida,Uttar Pradesh; Govt. PG Degree College,Dharamshala,Himachal Pradesh; Manipal University Jaipur,Department of Computer and Communication Engineering,Jaipur,Rajasthan",Publication Title,Publication Title
Contact Tracing Detection Application for Covid-19 using Machine Learning Techniques,M. Vengateshwaran; A. S. Harshana; N. Valarmathi; S. Jayanthi; E. Srividhya,"Sri Krishna College of Engineering &#x0026; Technology,Coimbatore; Sri Sai Ram Institute of Technology,Chennai; M. Kumarasamy College of Engineering,Karur; Sathyabama Institute of Science and Technology,Chennai; Sathyabama Institute of Science and Technology,Chennai",Publication Title,Publication Title
"A Survey on Mathematical, Machine Learning and Deep Learning Models for COVID-19 Transmission and Diagnosis",J. C. Clement; V. Ponnusamy; K. C. Sriharipriya; R. Nandakumar,"School of Electronics Engineering, Vellore Institute of Technology, Vellore, India; Department of Electronics and Communication Engineering, SRM Institute of Science and Technology, Kattankulathur, India; School of Electronics Engineering, Vellore Institute of Technology, Vellore, India; Department of Electronics and Communication Engineering, K.S.R Institute for Engineering and Technology, Kalvi Nagar, India",Publication Title,Publication Title
Preliminary Diagnosis of COVID-19 Based on Cough Sounds Using Machine Learning Algorithms,A. Anupam; N. J. Mohan; S. Sahoo; S. Chakraborty,"NIT Silchar,Deptt. of E&I; NIT Silchar,Deptt. of E&I; NIT Silchar,Deptt. of ECE; NIT Silchar,Deptt. of E&I",Publication Title,Publication Title
Applications of Machine Learning in Battling Against Novel COVID-19,R. R. Saeed; O. M. Yaseen; M. M. Rashid; M. R. Ahmed,"Northern Technical University,Biomedical engineering,Mosul,Iraq; Artificial intelligence, Ministry of Higher Education and Scientific Research, Computer science,Administrative and Financial Department,Baghdad,Iraq; Northern Technical University,Department of Radiology Techniques,Mosul,Iraq; Karabuk University,Computer Engineering,Karabuk,Turkey",Publication Title,Publication Title
Health Analytics on Big COVID-19 Data,N. D. T. Tran; C. K. Leung; D. L. X. Fung; T. H. D. Mai,"University of Manitoba,Department of Computer Science,Winnipeg,MB,Canada; University of Manitoba,Department of Computer Science,Winnipeg,MB,Canada; University of Manitoba,Department of Computer Science,Winnipeg,MB,Canada; University of Manitoba,Department of Computer Science,Winnipeg,MB,Canada",Publication Title,Publication Title
Accurate COVID-19 Health Outcome Prediction and Risk Factors Identification through an Innovative Machine Learning Framework Using Longitudinal Electronic Health Records,A. Feng,"The Harker School,San Jose,California,USA",Publication Title,Publication Title
Machine Learning based COVID-19 Mortality Prediction using Common Patient Data,S. Agrawal; N. Patil,"National Institute of Technology,Department of Information Technology,Mangalore,Karnataka,India; National Institute of Technology,Department of Information Technology,Mangalore,Karnataka,India",Publication Title,Publication Title
Computer intelligent prediction method of COVID-19 based on improved SEIR model and machine learning,W. Wu,"Peking University,Beijing,China",Publication Title,Publication Title
COVID-Net MLSys: Designing COVID-Net for the Clinical Workflow,A. G. Chuna; M. Pavlova; H. Gunraj; N. Terhljan; A. MacLean; H. Aboutalebi; S. Surana; A. Zhao; S. Abbasi; A. Wong,"University of Waterloo,Waterloo Artificial Intelligence Institute; University of Waterloo,Vision and Image Processing Research Group; University of Waterloo,Vision and Image Processing Research Group; University of Waterloo,Vision and Image Processing Research Group; University of Waterloo,Vision and Image Processing Research Group; University of Waterloo,Vision and Image Processing Research Group; University of Waterloo,Vision and Image Processing Research Group; University of Waterloo,Vision and Image Processing Research Group; University of Waterloo,Vision and Image Processing Research Group; University of Waterloo,Vision and Image Processing Research Group",Publication Title,Publication Title
Symptoms Based Covid-19 Disease Diagnosis Using Machine Learning Approach,M. A. Arshed; W. Qureshi; M. U. G. Khan; M. A. Jabbar,"Al-Khawarizmi Institute of Computer Science (KICS), University of Engineering and Technology (UET),Intelligent Criminology Research Lab (ICRL), National Center of Artificial Intelligence (NCAI),Lahore,Pakistan; The Islamia University of Bahawalpur (IUB),Department of Computer Science,Bahawalpur,Pakistan; Al-Khawarizmi Institute of Computer Science (KICS), University of Engineering and Technology (UET),Intelligent Criminology Research Lab (ICRL), National Center of Artificial Intelligence (NCAI),Lahore,Pakistan; University of Management and Technology (UMT),Department of Computer Science,Lahore,Pakistan",Publication Title,Publication Title
Predicting the Vulnerability of Covid-19 using Machine Learning Algorithm,V. Raorane; P. Ramane; Y. Raul; M. Trivedi,Vidyavardhini&#x2019;s College of Engineering and Technology; Vidyavardhini&#x2019;s College of Engineering and Technology; Vidyavardhini&#x2019;s College of Engineering and Technology; Vidyavardhini&#x2019;s College of Engineering and Technology,Publication Title,Publication Title
Extraction of events and qualitative data from texts for the monitoring of infectious diseases: case of meningitis and COVID-19,S. Malo; J. Thiombiano; Y. TRAORé,"University Nazi Boni,Laboratory of Algebra, Discrete Mathematics and Computer Science (LAMDI),Bobo Dioulasso,Burkina Faso; University Nazi Boni,Laboratory of Algebra, Discrete Mathematics and Computer Science (LAMDI),Bobo Dioulasso,Burkina Faso; University Nazi Boni,Laboratory of Algebra, Discrete Mathematics and Computer Science (LAMDI),Bobo Dioulasso,Burkina Faso",Publication Title,Publication Title
Analyzing and Predicting the Deaths and Cases of Covid-19 in Different Countries Using Fuzzy K Means Algorithm and Exponential Method,H. F. Kadom; R. M. Azeez,"Oil Products Distribution Company, Iraqi Ministry of Oil,Babylon,Iraq; Babylon Technical Institute,Technical Computer System Department,Babylon,Iraq",Publication Title,Publication Title
Predictive analysis of Covid on economy of India using machine learning technqiue,A. Jaiswal; A. K. Pandey; Piyush; R. R. Kumar; S. Omar; S. Vijh,"KIET Group of Institutions,Uttar Pradesh,India; KIET Group of Institutions,Uttar Pradesh,India; KIET Group of Institutions,Uttar Pradesh,India; KIET Group of Institutions,Uttar Pradesh,India; KIET Group of Institutions,Uttar Pradesh,India; KIET Group of Institutions,Uttar Pradesh,India",Publication Title,Publication Title
Analysis of cough sound measurements including COVID-19 positive cases: A machine learning characterization,J. J. Valdés; P. Xi; M. Cohen-McFarlane; B. Wallace; R. Goubran; F. Knoefel,"Digital Technologies National Research Council Canada,Ottawa,Canada; Digital Technologies National Research Council Canada,Ottawa,Canada; Carleton University,Department of Systems and Computer Engineering,Ottawa,Canada; Carleton University,Bruyère Research Institute SAM3 Innovation Hub,Canada; Carleton University,Department of Systems and Computer Engineering,Ottawa,Canada; Carleton University,Bruyère Research Institute Elizabeth Bruyère Hospital,Ottawa,Canada",Publication Title,Publication Title
ICU Admission Prediction Using Machine Learning for Covid-19 Patients,N. D. Parbate; A. P. Palande; S. K. Wagh; A. Kamble; S. Isave,"Modern Education Society’s College of Engineering,Department of Computer Engineering,Pune,India; Modern Education Society’s College of Engineering,Department of Computer Engineering,Pune,India; Modern Education Society’s College of Engineering,Department of Computer Engineering,Pune,India; Modern Education Society’s College of Engineering,Department of Computer Engineering,Pune,India; Modern Education Society’s College of Engineering,Department of Computer Engineering,Pune,India",Publication Title,Publication Title
Prediction of Diabetes and Symptoms of Covid-19 Using Machine Learning Classifiers,S. T. Baby; S. B. Xavier; G. J. W. Kathrine,"Karunya University,Department of Computer Science,Coimbatore,Tamil Nadu,India; Karunya University,Department of Computer Science,Coimbatore,Tamil Nadu,India; Karunya University,Department of Computer Science,Coimbatore,Tamil Nadu,India",Publication Title,Publication Title
A Survey on Machine Learning and Internet of Things for COVID-19,E. Elbasi; S. Mathew; A. E. Topcu; W. Abdelbaki,"College of Engineering and Technology, American University of the Middle East,Kuwait; College of Engineering and Technology, American University of the Middle East,Kuwait; College of Engineering and Technology, American University of the Middle East,Kuwait; College of Engineering and Technology, American University of the Middle East,Kuwait",Publication Title,Publication Title
A Study on Predicting Customer Willingness to Order Food Online During Covid-19 Pandemic Using Machine Learning Algorithms,K. Aditya Sobika; S. N. Vivek Raj,"KCT Business School, Kumaraguru College of Technology,Coimbatore,India; KCT Business School, Kumaraguru College of Technology,Coimbatore,India",Publication Title,Publication Title
COVID-19 Mortality Prediction Using Machine Learning Techniques,L. Schirato; K. Makina; D. Flanders; S. Pouriyeh; H. Shahriar,"Kennesaw State University,Department of Information Technology,Marietta,GA,USA; Kennesaw State University,Department of Information Technology,Marietta,GA,USA; Kennesaw State University,Department of Information Technology,Marietta,GA,USA; Kennesaw State University,Department of Information Technology,Marietta,GA,USA; Kennesaw State University,Department of Information Technology,Marietta,GA,USA",Publication Title,Publication Title
Coronavirus Disease (COVID-19) Global Prediction Using Hybrid Artificial Intelligence Method of ANN Trained with Grey Wolf Optimizer,S. Ardabili; A. Mosavi; S. S. Band; A. R. Varkonyi-Koczy,"University of Mohaghegh Ardabili,Department of Biosystem Engineering,Ardabil,Iran; Institute of Automation, Obuda University,Budapest,Hungary,1034; National Yunlin University of Science and Technology,Yunlin,Taiwan,64002; Institute of Automation, Obuda University,Budapest,Hungary,1034",Publication Title,Publication Title
Time Series Forecasting of COVID-19 Infections in United Arab Emirates using ARIMA,L. Ismail; S. Alhmoudi; S. Alkatheri,"United Arab Emirates University,Distributed Computing and Systems Research Laboratory College of Information Technology,Abu Dhabi,United Arab Emirates,15551; United Arab Emirates University,Distributed Computing and Systems Research Laboratory College of Information Technology,Abu Dhabi,United Arab Emirates,15551; United Arab Emirates University,Distributed Computing and Systems Research Laboratory College of Information Technology,Abu Dhabi,United Arab Emirates,15551",Publication Title,Publication Title
COVID-19 Outbreak from the Experience of Wave 1 and start of Wave 2: Comparison and Analysis,A. V. Munot; E. Niteen Mohod; S. R. Hemnani; B. Sonare,"Pimpri-Chinchwad College of Engineering,Department of Information Technology,Pune,Maharashtra; Pimpri-Chinchwad College of Engineering,Department of Information Technology,Pune,Maharashtra; Pimpri-Chinchwad College of Engineering,Department of Information Technology,Pune,Maharashtra; Pimpri-Chinchwad College of Engineering,Department of Information Technology,Pune,Maharashtra",Publication Title,Publication Title
HR During Covid-19 Era: Study On Recent HR Transformations Through Technological Tools And Trends,M. Saxena; T. Bagga; S. Gupta,"Amity University,Research Scholar, ABS,Noida,India; Amity University,Amity Business School,Noida,India; Management M.E.R.I,Delhi,India",Publication Title,Publication Title
Development and Validation of an Early Scoring System for Prediction of Disease Severity in COVID-19 Using Complete Blood Count Parameters,T. Rahman; A. Khandakar; M. E. Hoque; N. Ibtehaz; S. B. Kashem; R. Masud; L. Shampa; M. M. Hasan; M. T. Islam; S. Al-Maadeed; S. M. Zughaier; S. Badran; S. A. R. Doi; M. E. H. Chowdhury,"Department of Electrical Engineering, Qatar University, Doha, Qatar; Department of Electrical Engineering, Qatar University, Doha, Qatar; Department of Biomedical Engineering, Military Institute of Science and Technology, Dhaka, Bangladesh; Department of Computer Science and Engineering, Bangladesh University of Engineering and Technology, Dhaka, Bangladesh; Faculty of Robotics and Advanced Computing, Qatar Armed Forces-Academic Bridge Program, Qatar Foundation, Doha, Qatar; COVID Isolation Unit, United Hospitals, Ltd., Dhaka, Bangladesh; Department of Obstetrics and Gynecology, Dhaka Medical College Hospital (COVID UNIT), Dhaka, Bangladesh; Dhaka North City Corporation COVID Hospital, Dhaka, Bangladesh; Department of Electrical, Electronics and Systems Engineering, Universiti Kebangsaan Malaysia, Bangi, Selangor, Malaysia; Department of Computer Science and Engineering, Qatar University, Doha, Qatar; Department of Basic Medical Sciences, College of Medicine, QU Health, Qatar University, Doha, Qatar; Department of Plastic Surgery, Hamad Medical Corporation, Doha, Qatar; Department of Population Medicine, College of Medicine, QU Health, Qatar University, Doha, Qatar; Department of Electrical Engineering, Qatar University, Doha, Qatar",Publication Title,Publication Title
Application of Face Recognition in Tracing COVID-19 Fever Patients and Close Contacts,W. Tan; J. Liu,"LinkSpirte Technologies,Longmont,CO,USA; Shenzhen Deepcam Information Technologies,Shenzhen,China",Publication Title,Publication Title
