Document Title,Authors,Author Affiliations,Publication Title,Publication Title
Mining the Associations between V(D)J Gene Segments and COVID-19 Disease Characteristics,Y. Zhao; Y. Zhang; Z. -A. Huang; F. Yang; L. Duan; J. Yao,"AI Lab, Tencent,Shenzhen,China; Sichuan University,School of Computer Science,Chengdu,China; City University of Hong Kong Dongguan Research Institute,Center for Computer Science and Technology,Dongguan,China; AI Lab, Tencent,Shenzhen,China; Sichuan University,School of Computer Science,Chengdu,China; AI Lab, Tencent,Shenzhen,China",Publication Title,Publication Title
Prediction of COVID-19 from Chest X-ray Images Using Multiresolution Texture Classification with Robust Local Features,Z. A. Oraibi; S. Albasri,"University of Basrah,College of Education for Pure Sciences,Dept. of Computer Science,Basrah,Iraq; University of Missouri,College of Engineering,Dept. of Electrical Engineering and Computer Science,Columbia,Missouri,USA",Publication Title,Publication Title
Study of the Performance of Machine Learning Algorithms for Face Mask Detection,W. Vijitkunsawat; P. Chantngarm,"Electronics and Telecommunication Engineering, Rajamagala University of Technology Krungthep,Bangkok,Thailand,10120; Electronics and Telecommunication Engineering, Rajamagala University of Technology Krungthep,Bangkok,Thailand,10120",Publication Title,Publication Title
Covid-19 Projections: A Simple Machine Learning Approach,G. Ortigoza; U. Zapata,"Universidad Veracruzana,Facultad de Ingeniería,Boca del Río Veracruz,México; Universidad Veracruzana,Facultad de Ingeniería,Boca del Río Veracruz,México",Publication Title,Publication Title
DeepCOVIDNet: An Interpretable Deep Learning Model for Predictive Surveillance of COVID-19 Using Heterogeneous Features and Their Interactions,A. Ramchandani; C. Fan; A. Mostafavi,"Department of Computer Science and Engineering, Texas A&M University, College Station, TX, USA; Zachry Department of Civil and Environmental Engineering, Texas A&M University, College Station, TX, USA; Zachry Department of Civil and Environmental Engineering, Texas A&M University, College Station, TX, USA",Publication Title,Publication Title
Covid19 Vaccination and Lifestyle Counsel using Machine Learning algorithms,S. Madumidha; R. P. Siva; B. Keerthana; R. E. V. Navin; R. Janarthanan; A. K. Karthikeyan,"Sri Krishna College of Technology,Dept. of Information and Technology,Coimbatore,Tamil Nadu,India; Kongu Engineering College,Dept.of ECE,Erode,Tamil Nadu,India; Sri Krishna College of Technology,Dept. of Information and Technology,Coimbatore,Tamil Nadu,India; Sri Krishna College of Technology,Dept. of Information and Technology,Coimbatore,Tamil Nadu,India; Sri Krishna College of Technology,Dept. of Information and Technology,Coimbatore,Tamil Nadu,India; Sri Krishna College of Technology,Dept. of Information and Technology,Coimbatore,Tamil Nadu,India",Publication Title,Publication Title
Mask Detection in Crowded Environment using Machine Learning,B. A; N. K. M; A. Kumar Sivaraman; R. Vincent; R. M,"Vellore Institute of Technology (VIT),Centre for Cyber Physical Systems, School of Computer Science and Engineering,Chennai,India; Vellore Institute of Technology (VIT),School of Computer Science and Engineering,Chennai,India; Vellore Institute of Technology (VIT),School of Computer Science and Engineering,Chennai,India; Vellore Institute of Technology (VIT),School of Computer Science and Engineering,Chennai,India; Vellore Institute of Technology (VIT),School of Computer Science and Engineering,Chennai,India",Publication Title,Publication Title
Using Q-Learning to Personalize Pedagogical Policies for Addition Problems,D. Shen; T. Truong; C. Weintz,"Stanford University,Computer Science,Stanford,CA,USA,94305; Stanford University,Computer Science,Stanford,CA,USA,94305; Stanford University,Computer Science,Stanford,CA,USA,94305",Publication Title,Publication Title
"Remuneration Review: Risk, Planning, and Modelling beyond the Covid Crisis",M. Cherrington; D. Airehrour; S. Madanian; J. Lu; Q. Xu; P. Artiushkina,"School of Computing and Engineering, University of Huddersfield,Huddersfield,United Kingdom; School of Applied Business Unitec Institute of Technology,Auckland,New Zealand; Auckland University of Technology,Department of Computer Science,Auckland,New Zealand; University of Huddersfield,Department of Computer Science,Huddersfield,United Kingdom; University of Huddersfield,Department of Engineering Technology,Huddersfield,United Kingdom; Otago Polytechnic AIC,Department of Applied Management,Auckland,New Zealand",Publication Title,Publication Title
A Comparative Study on the Prediction Model of COVID-19,Q. Zhou; W. Tao; Y. Jiang; B. Cui,"Anhui Polytechnic University,School of Computer and Information,Wuhu,China; Anhui Polytechnic University,School of Computer and Information,Wuhu,China; Anhui Polytechnic University,School of Computer and Information,Wuhu,China; Anhui Polytechnic University,School of Computer and Information,Wuhu,China",Publication Title,Publication Title
Using Machine Learning Approaches to Distinguish COVID-19 from Other Upper Respiratory Tract Infections,D. Rahhal; R. Alhamouri; A. Mustafa,"Jordan University of Science and Technology,Department of Computer and Information Systems,Irbid,Jordan; Jordan University of Science and Technology,Department of Computer and Information Systems,Irbid,Jordan; Jordan University of Science and Technology,Department of Computer and Information Systems,Irbid,Jordan",Publication Title,Publication Title
"Diagnosis/Prognosis of COVID-19 Chest Images via Machine Learning and Hypersignal Processing: Challenges, opportunities, and applications",A. Mohammadi; Y. Wang; N. Enshaei; P. Afshar; F. Naderkhani; A. Oikonomou; J. Rafiee; H. Rodrigues de Oliveira; S. Yanushkevich; K. N. Plataniotis,"Concordia Institute for Information System Engineering (CIISE), Concordia University, Montreal, H3G1M8 Quebec, Canada; ECE, University of Calgary, Calgary, T2N 1N4 Alberta, Canada; Concordia Institute for Information System Engineering (CIISE), Concordia University, Montreal, Quebec, Canada; Concordia Institute for Information System Engineering (CIISE), Concordia University, Montreal, Quebec, Canada; Concordia Institute for Information System Engineering (CIISE), Concordia University, Montreal, Quebec, Canada; Department of Medical Imaging, Sunnybrook Health Sciences Centre, University of Toronto, Toronto, Ontario, Canada; Department of Medicine and Diagnostic Radiology, McGill University Health Centre, Montreal, Quebec, Canada; ECE, University of Calgary, Calgary, Alberta, Canada; Dept of Electrical and Computer Eng, Univ of Calgary, Calgary, T2N 1N4 Alberta, Canada; Electrical and Computer Engineering, University of Toronto, Toronto, M5S3G4 Ontario, Canada",Publication Title,Publication Title
Analyzing the Effects of COVID-19 Pandemic on the Energy Demand: the Case of Northern Italy,P. Scarabaggio; M. La Scala; R. Carli; M. Dotoli,"Polytechnic of Bari,Dept. of Electrical and Information Engineering,Bari,Italy; Polytechnic of Bari,Dept. of Electrical and Information Engineering,Bari,Italy; Polytechnic of Bari,Dept. of Electrical and Information Engineering,Bari,Italy; Polytechnic of Bari,Dept. of Electrical and Information Engineering,Bari,Italy",Publication Title,Publication Title
Understanding the Applications of Natural Language Processing on COVID-19 Data,S. Verma; A. Paul; S. S. Kariyannavar; R. Katarya,"Delhi Technological University,Department of Computer Engineering,Delhi,India; Delhi Technological University,Department of Computer Engineering,Delhi,India; Delhi Technological University,Department of Computer Engineering,Delhi,India; Delhi Technological University,Department of Computer Engineering,Delhi,India",Publication Title,Publication Title
An Arabic Corpus for Covid-19 related Fake News,D. Mohdeb; M. Laifa; M. Naidja,"Mohamed El Bachir El Ibrahimi University,Computer Science Departement,Bordj Bou Arreridj,Algeria; Mohamed El Bachir El Ibrahimi University,Computer Science Departement,Bordj Bou Arreridj,Algeria; Mohamed El Bachir El Ibrahimi University,Computer Science Departement,Bordj Bou Arreridj,Algeria",Publication Title,Publication Title
IoT based Health Monitoring & Automated Predictive System to Confront COVID-19,M. M. S. Choyon; M. Rahman; M. M. Kabir; M. F. Mridha,"American International University-Bangladesh,Department of Electrical and Electronic Engineering,Dhaka,Bangladesh; Daffodil International University,Department of Computer Science and Engineering,Dhaka,Bangladesh; Bangladesh University of Business & Technology,Department of Computer Science and Engineering,Dhaka,Bangladesh; Bangladesh University of Business & Technology,Department of Computer Science and Engineering,Dhaka,Bangladesh",Publication Title,Publication Title
A hybrid deep transfer learning based approach for COVID-19 classification in chest X-ray images,K. Rezaee; A. Badiei; S. Meshgini,"Meybod University,Department of Biomedical Engineering,Meybod,Iran; University of Tabriz,Faculty of Electrical and Computer Engineering,Department of Biomedical Engineering,Tabriz,Iran; University of Tabriz,Faculty of Electrical and Computer Engineering,Department of Biomedical Engineering,Tabriz,Iran",Publication Title,Publication Title
Predicting Depression from Social Networking Data using Machine Learning Techniques,N. Bagga; P. Vashistha; P. Yadav,"Galgotias University,CSE AI and ML,Greater Noida; Galgotias University,CSE AI and ML,Greater Noida; Galgotias University,CSE,Greater Noida,India",Publication Title,Publication Title
Estimation of Hourly Utility Usage Using Machine Learning,A. Wong; C. Chiu; A. Abdulgapul; M. N. Beg; Y. Khmelevsky; J. Mahony,"Langara College,Mathematics and Statistics,Vancouver,BC,Canada; Langara College,Mathematics and Statistics,Vancouver,BC,Canada; Langara College,Mathematics and Statistics,Vancouver,BC,Canada; Langara College,Mathematics and Statistics,Vancouver,BC,Canada; Okanagan College,Computer Science,Kelowna,BC,Canada; Harris SmartWorks,Ottawa,Ontario,Canada",Publication Title,Publication Title
Programmable Detection of COVID-19 Infection Using Chest X-Ray Images Through Transfer Learning,V. Triveni; R. G. Priyanka; K. D. Teja; Y. Sangeetha,"VRSEC,Information Technology,Vijayawada,India; VRSEC,Information Technology,Vijayawada,India; VRSEC,Information Technology,Vijayawada,India; VRSEC,Information Technology,Vijayawada,India",Publication Title,Publication Title
Predicting Depression from Social Networking Data using Machine Learning Techniques,N. Bagga; P. Vashistha; P. Yadav,"Galgotias University,CSE AI and ML,Greater noida,India; Galgotias University,CSE AI and ML,Greater noida,India; Galgotias University,CSE,Greater noida,India",Publication Title,Publication Title
Resetting the baseline: CT-based COVID-19 diagnosis with Deep Transfer Learning is not as accurate as widely thought,F. Altaf; S. M. S. Islam; N. Akhtar,"School of Science Edith Cowan University,Joondalup,Australia; School of Science Edith Cowan University,Joondalup,Australia; Computer Science & Software Engineering University of Western Australia,Crawley,Australia",Publication Title,Publication Title
A Deep Learning-based System for Detecting COVID-19 Patients,N. Nasser; Q. Emad-ul-Haq; M. Imran; A. Ali; A. Al-Helali,"Alfaisal University,College of Enigneering,KSA; King Saud University,College of Computer and Information Sciences,KSA; King Saud University,College of Computer and Information Sciences,KSA; Queen’s University,School of Computing,Canada; Alfaisal University,College of Enigneering,KSA",Publication Title,Publication Title
Sentiment Analysis of COVID-19 on Saudi Trending Hashtags Using Recurrent Neural Network,L. A. Alhuri; H. R. Aljohani; R. M. Almutairi; F. Haron,"Taibah University,College of Computer Science and Engineering,Medina,Saudi Arabia; Taibah University,College of Computer Science and Engineering,Medina,Saudi Arabia; Taibah University,College of Computer Science and Engineering,Medina,Saudi Arabia; Prince Muqrin University,College of Computer and Cyber Sciences,Medina,Saudi Arabia",Publication Title,Publication Title
Mediated Solidarity and Community Resilience on Twitter During Covid-19 Pandemic in Indonesia,A. F. Kalaloi; A. Primayanti; I. A. Dianita; G. Mahestu; P. Dirgantara,"Telkom University,Department of Communication Science,Bandung,Indonesia; Telkom University,Department of Communication Science,Bandung,Indonesia; Telkom University,Department of Communication Science,Bandung,Indonesia; Telkom University,Department of Communication Science,Bandung,Indonesia; Telkom University,Department of Communication Science,Bandung,Indonesia",Publication Title,Publication Title
4 COVID-19 Forecasting Using Deep Learning Models,S. Cheguru; P. CH; K. Tejasree; T. Deepthi; Y. Vijayalata; G. Siddhartha,NA; NA; NA; NA; NA; NA,Publication Title,Publication Title
Predicting the level of generalized anxiety disorder of the coronavirus pandemic among college age students using artificial intelligence technology,H. Alharthi,"College of Public Health, Imam Abdulrahman Bin Faisal University (IAU),Dept. of Health Information Management & Technology,Dammam,Saudi Arabia",Publication Title,Publication Title
Covid-19 X-ray image classification using SVM based on Local Binary Pattern,S. Al-Jumaili; A. Al-Azzawi; A. D. Duru; A. A. Ibrahim,"Altinbas University,Electrical and computer engineering,Istanbul,Turkey; Altinbas University,Information technologies department,Istanbul,Turkey; Marmara University,Neuroscience and Psychology Research in Sports Lab,Istanbul,Turkey; Altinbas University,Electrical and computer engineering,Istanbul,Turkey",Publication Title,Publication Title
COVID-19 fake news detection using attention-based transformer,J. Xi; C. Zhang,NA; NA,Publication Title,Publication Title
"Project Achoo: A Practical Model and Application for COVID-19 Detection From Recordings of Breath, Voice, and Cough",A. Ponomarchuk; I. Burenko; E. Malkin; I. Nazarov; V. Kokh; M. Avetisian; L. Zhukov,"AI Lab, Sberbank of Russia, Moscow, Russia; AI Lab, Sberbank of Russia, Moscow, Russia; AI Lab, Sberbank of Russia, Moscow, Russia; AI Lab, Sberbank of Russia, Moscow, Russia; AI Lab, Sberbank of Russia, Moscow, Russia; AI Lab, Sberbank of Russia, Moscow, Russia; AI Lab, Sberbank of Russia, Moscow, Russia",Publication Title,Publication Title
A Supervised Multi-tree XGBoost Model for an Earlier COVID-19 Diagnosis Based on Clinical Symptoms,A. H. Syed; T. Khan,"King Abdulaziz University,Faculty of Computing and Information Technology Rabigh,Department of Computer Science,Jeddah,Saudi Arabia; King Abdulaziz University,Faculty of Computing and Information Technology Rabigh,Department of Information System,Jeddah,Saudi Arabia",Publication Title,Publication Title
Towards Evaluating the COVID’19 related Fake News Problem: Case of Morocco,O. Maakoul; S. Boucht; K. EL HACHIMI; S. Azzouzi,"Ibn Tofail University,ISO-Lab: Laboratory of Informatics, Systems and Optimization Faculty of Science,Kenitra,Morocco; Ibn Tofail University,ISO-Lab: Laboratory of Informatics, Systems and Optimization Faculty of Science,Kenitra,Morocco; Ibn Tofail University,ISO-Lab: Laboratory of Informatics, Systems and Optimization Faculty of Science,Kenitra,Morocco; Ibn Tofail University,ISO-Lab: Laboratory of Informatics, Systems and Optimization Faculty of Science,Kenitra,Morocco",Publication Title,Publication Title
A Comparative Study of Classification Approaches for COVID-19 Prediction,S. M. M. Hasan; M. F. Rabbi; A. I. Champa; M. A. Zaman,"Rajshahi University of Engineering & Technology,Department of Computer Science & Engineering,Rajshahi,Bangladesh,6204; Islamic University of Technology,Department of Computer Science & Engineering,Gazipur,Bangladesh; Islamic University of Technology,Department of Computer Science & Engineering,Gazipur,Bangladesh; North South University",Publication Title,Publication Title
AI Based Smart Remedial Observants in COVID-19 Crisis,S. Kumar; A. Panwal; S. Gharat; N. Ghatte; D. Karia,"Sardar Patel Institute of Technology,Electronics Department,Mumbai,India; Sardar Patel Institute of Technology,Electronics Department,Mumbai,India; Sardar Patel Institute of Technology,Electronics Department,Mumbai,India; Sardar Patel Institute of Technology,Electronics Department,Mumbai,India; Sardar Patel Institute of Technology,Electronics Department,Mumbai,India",Publication Title,Publication Title
Professors' Concerns after the Shift from Face-to-face to Online Teaching amid COVID-19 Contingency: An Educational Data Mining analysis,S. M. De Oca; M. Villada-Balbuena; C. Camacho-Zu&#x00F1;iga,"School of Engineering and Science Tecnologico de Monterrey,Toluca,Mexico; School of Engineering and Science Tecnologico de Monterrey,Toluca,Mexico; School of Engineering and Science Tecnologico de Monterrey,Toluca,Mexico",Publication Title,Publication Title
Towards Using Deep Reinforcement Learning for Better COVID-19 Vaccine Distribution Strategies,F. Trad; S. El Falou,"Lebanese University,Computer and Communication Engineering,Ras Maska, Al-Koura,Lebanon; Lebanese University,Computer and Communication Engineering,Ras Maska, Al-Koura,Lebanon",Publication Title,Publication Title
Predicting the Epidemics Trend of COVID-19 Using Epidemiological-Based Generative Adversarial Networks,H. Wang; G. Tao; J. Ma; S. Jia; L. Chi; H. Yang; Z. Zhao; J. Tao,"College of Computer Science, Zhejiang University, Hangzhou, China; Department of Radiology, Shanghai Chest Hospital, Shanghai Jiao Tong University, Shanghai, China; College of Computer and Information Engineering, Tianjin Normal University, Tianjin, China; College of Computer and Information Engineering, Tianjin Normal University, Tianjin, China; Department of Computer Science, La Trobe University, Melbourne, VIC, Australia; Cyberspace Institute of Advanced Technology, Guangzhou University, Guangzhou, China; College of Computer and Information Engineering, Tianjin Normal University, Tianjin, China; National Laboratory of Pattern Recognition (NLPR), Institute of Automatic Chinese Academy of Sciences, Beijing, China",Publication Title,Publication Title
A Novel Web Platform for COVID-19 diagnosis using X-Ray exams and Deep Learning Techniques,V. X. Nunes; A. G. Medeiros; R. S. de Lima; L. F. de F. Souza; V. H. C. de Albuquerque; P. P. R. Filho,"Laboratório de Processamento de Imagens, Sinais e Computação Aplicada (LAPISCO); Laboratório de Processamento de Imagens, Sinais e Computação Aplicada (LAPISCO); Laboratório de Processamento de Imagens, Sinais e Computação Aplicada (LAPISCO); Laboratório de Processamento de Imagens, Sinais e Computação Aplicada (LAPISCO); Federal University of Ceará (UFC),Fortaleza,Ceará,Brazil; Laboratório de Processamento de Imagens, Sinais e Computação Aplicada (LAPISCO)",Publication Title,Publication Title
Feature Selection by Hybrid Binary Ant Lion Optimizer with COVID-19 dataset,I. Strumberger; A. Rakic; S. Stanojlovic; J. Arandjelovic; T. Bezdan; M. Zivkovic; N. Bacanin,"Singidunum University,Informatics and Computing,Belgrade,Serbia; Singidunum University,Informatics and Computing,Belgrade,Serbia; Singidunum University,Informatics and Computing,Belgrade,Serbia; Singidunum University,Informatics and Computing,Belgrade,Serbia; Singidunum University,Informatics and Computing,Belgrade,Serbia; Singidunum University,Informatics and Computing,Belgrade,Serbia; Singidunum University,Informatics and Computing,Belgrade,Serbia",Publication Title,Publication Title
Sentimental Analysis for Studying and Analyzing the Spreading of COVID-19 from Twitter Data,Q. B. Baker; A. A. Aqouleh; O. Altiti,"Jordan University of Science and Technology,Computer Science Department,Irbid,Jordan; Jordan University of Science and Technology,Computer Science Department,Irbid,Jordan; Jordan University of Science and Technology,Computer Science Department,Irbid,Jordan",Publication Title,Publication Title
COVID-19: Affect recognition through voice analysis during the winter lockdown in Scotland,S. de la Fuente Garcia; F. Haider; S. Luz,"The University of Edinburgh,Usher Institute, in the Edinburgh Medical School,UK; The University of Edinburgh,Usher Institute, in the Edinburgh Medical School,UK; The University of Edinburgh,Usher Institute, in the Edinburgh Medical School,UK",Publication Title,Publication Title
Work From Home After Covid-19: Machine Learning-Based Approach to Predict Employee's Choice,B. T. G. S. Kumara; G. A. C. A. Herath; P. M. A. K. Wijeratne; K. Banujan,"Sabaragamuwa University of Sri Lanka,Department of Computing and Information Systems,Belihuloya,Sri Lanka; Sabaragamuwa University of Sri Lanka,Department of Computing and Information Systems,Belihuloya,Sri Lanka; Sabaragamuwa University of Sri Lanka,Department of Computing and Information Systems,Belihuloya,Sri Lanka; Sabaragamuwa University of Sri Lanka,Department of Computing and Information Systems,Belihuloya,Sri Lanka",Publication Title,Publication Title
Unlocking the Public Perception of COVID-19 Vaccination Process on Social Media,R. El-Deeb; F. E. -Z. El-Gamal; N. Sakr; S. Elhishi; S. El-Metwally,"Mansoura University,Faculty of Computers and Information,Computer Science Department,Mansoura,Egypt,35516; Mansoura University,Faculty of Computers and Information,Information Tecnology Department,Mansoura,Egypt,35516; Mansoura University,Faculty of Computers and Information,Information Tecnology Department,Mansoura,Egypt,35516; Mansoura University,Faculty of Computers and Information,Information System Department,Mansoura,Egypt,35516; Mansoura University,Faculty of Computers and Information,Computer Science Department,Mansoura,Egypt,35516",Publication Title,Publication Title
Detection of Novel Coronavirus from Chest X-Ray Radiograph Images via Automated Machine Learning and CAD4COVID,K. Izdihar; M. K. A. Karim; N. N. Aresli; S. F. M. Radzi; A. Sabarudin; M. M. Yunus; M. A. A. Rahman; S. Shamsul,"KPJ Healthcare University College,School of Health Sciences),Department of Medical Imaging,Nilai,N. Sembilan,Malaysia; Universiti Putra Malaysia,Faculty of Science,Department of Physics,Serdang,Selangor,Malaysia,43400; Universiti Putra Malaysia,Faculty of Science,Department of Physics,Serdang,Selangor,Malaysia,43400; Universiti Putra Malaysia,Faculty of Science,Department of Physics,Serdang,Selangor,Malaysia,43400; Universiti Kebangsaan Malaysia,Faculty of Health Sciences,Kuala Lumpur,Malaysia,50300; Universiti Kebangsaan Malaysia,Faculty of Health Sciences,Kuala Lumpur,Malaysia,50300; Universiti Putra Malaysia,Faculty of Science,Department of Physics,Serdang,Selangor,Malaysia,43400; UKM Medical Centre,Department of Radiology,Kuala Lumpur,Malaysia,56000",Publication Title,Publication Title
Human Mobility-Based Features to Analyse the Impact of COVID-19 on Power System Operation of Ireland,N. Zarbakhsh; M. S. Misaghian; G. Mcardle,"School of Computer Science, University College Dublin, Belfield, Dublin 4, Ireland; School of Electrical and Electronic Engineering, University College Dublin, Belfield, Dublin 4, Ireland; School of Computer Science, University College Dublin, Belfield, Dublin 4, Ireland",Publication Title,Publication Title
RAM-Net: A Residual Attention MobileNet to Detect COVID-19 Cases from Chest X-Ray Images,M. A. Rab Ratul; M. Tavakol Elahi; K. Yuan; W. Lee,"University of Ottawa,School of Electrical Engineering and Computer Science (SITE),Ottawa,Canada; University of Ottawa,School of Electrical Engineering and Computer Science (SITE),Ottawa,Canada; University of Ottawa,School of Electrical Engineering and Computer Science (SITE),Ottawa,Canada; University of Ottawa,School of Electrical Engineering and Computer Science (SITE),Ottawa,Canada",Publication Title,Publication Title
Novel Feature Selection and Voting Classifier Algorithms for COVID-19 Classification in CT Images,E. -S. M. El-Kenawy; A. Ibrahim; S. Mirjalili; M. M. Eid; S. E. Hussein,"Department of Communications and Electronics, Delta Higher Institute of Engineering and Technology (DHIET), Mansoura, Egypt; Computer Engineering and Control Systems Department, Faculty of Engineering, Mansoura University, Mansoura, Egypt; Centre for Artificial Intelligence Research and Optimization, Torrens University Australia, Fortitude Valley, QLD, Australia; Department of Communications and Electronics, Delta Higher Institute of Engineering and Technology (DHIET), Mansoura, Egypt; Computer Engineering and Control Systems Department, Faculty of Engineering, Mansoura University, Mansoura, Egypt",Publication Title,Publication Title
Predicting Covid-19 Positive Cases and Analysis on the Relevance of Features using SHAP (SHapley Additive exPlanation),M. N. S. Choudary; V. B. Bommineni; G. Tarun; G. P. Reddy; G. Gopakumar,"Amrita Vishwa Vidyapeetham,Department of Computer Science and Engineering,Amritapuri,India; Amrita Vishwa Vidyapeetham,Department of Computer Science and Engineering,Amritapuri,India; Amrita Vishwa Vidyapeetham,Department of Computer Science and Engineering,Amritapuri,India; Amrita Vishwa Vidyapeetham,Department of Computer Science and Engineering,Amritapuri,India; Amrita Vishwa Vidyapeetham,Department of Computer Science and Engineering,Amritapuri,India",Publication Title,Publication Title
Research on Data acquisition technology of COVID-19 information Based on SCRAPY_REDIS,A. Qi,"City College of Dongguan Institute of Technology,Guangdong,Dongguan,China",Publication Title,Publication Title
From Hume to Wuhan: An Epistemological Journey on the Problem of Induction in COVID-19 Machine Learning Models and its Impact Upon Medical Research,C. Vega,"Luxembourg Centre for Systems Biomedicine, Bioinformatics Core Group, Université du Luxembourg, Esch-sur-Alzette, Luxembourg",Publication Title,Publication Title
