Document Title,Authors,Author Affiliations,Publication Title,Publication Title
"Harnessing the Power of Smart and Connected Health to Tackle COVID-19: IoT, AI, Robotics, and Blockchain for a Better World",F. Firouzi; B. Farahani; M. Daneshmand; K. Grise; J. Song; R. Saracco; L. L. Wang; K. Lo; P. Angelov; E. Soares; P. -S. Loh; Z. Talebpour; R. Moradi; M. Goodarzi; H. Ashraf; M. Talebpour; A. Talebpour; L. Romeo; R. Das; H. Heidari; D. Pasquale; J. Moody; C. Woods; E. S. Huang; P. Barnaghi; M. Sarrafzadeh; R. Li; K. L. Beck; O. Isayev; N. Sung; A. Luo,"Electrical and Computer Engineering Department, Duke University, Durham, NC, USA; Cyberspace Research Institute, Shahid Beheshti University, Tehran, Iran; Business Intelligence and Analytics, Stevens Institute of Technology, Hoboken, NJ, USA; IEEE Future Directions, Piscataway, NJ, USA; Department of Computer and Information Security, Sejong University, Seoul, South Korea; IEEE Future Directions, Piscataway, NJ, USA; Allen Institute for Artificial Intelligence, Seattle, WA, USA; Allen Institute for Artificial Intelligence, Seattle, WA, USA; School of Computing and Communications, Lancaster University, Lancashire, U.K.; School of Computing and Communications, Lancaster University, Lancashire, U.K.; Department of Mathematical Sciences, Carnegie Mellon University, Pittsburgh, PA, USA; Cyberspace Research Institute, Shahid Beheshti University, Tehran, Iran; Cyberspace Research Institute, Shahid Beheshti University, Tehran, Iran; Cyberspace Research Institute, Shahid Beheshti University, Tehran, Iran; Sina Hospital, Tehran, Iran; Sina Hospital, Tehran, Iran; Cyberspace Research Institute, Shahid Beheshti University, Tehran, Iran; Department of Information Engineering, Universit Politecnica delle Marche, Ancona, Italy; James Watt School of Engineering, University of Glasgow, Glasgow, U.K.; James Watt School of Engineering, University of Glasgow, Glasgow, U.K.; School of Medicine and Duke Health, Duke University, Durham, NC, USA; School of Medicine and Duke Health, Duke University, Durham, NC, USA; School of Medicine and Duke Health, Duke University, Durham, NC, USA; School of Medicine and Duke Health, Duke University, Durham, NC, USA; Department of Brain Sciences, Imperial College London, London, U.K.; Computer Science Department &#x0026; Electrical and Computer Engineering Department, University of California at Los Angeles, Los Angeles, CA, USA; Department of Medicine, Stanford University School of Medicine, Stanford, CA, USA; Almaden Research Center, IBM, San Jose, CA, USA; Department of Chemistry, Carnegie Mellon University, Pittsburgh, PA, USA; Korea Electronics Technology Institute, Seongnam, South Korea; Computer Science Department, Stanford University, Stanford, CA, USA",Publication Title,Publication Title
ANN Assisted-IoT Enabled COVID-19 Patient Monitoring,G. Rathee; S. Garg; G. Kaddoum; Y. Wu; D. N. K. Jayakody; A. Alamri,"Department of Computer Science and Engineering, Jaypee University of Information Technology, Waknaghat, India; Electrical Engineering Department, École de Technologie Supérieure, Université du Québec, Montréal, QC, Canada; Electrical Engineering Department, École de Technologie Supérieure, Université du Québec, Montréal, QC, Canada; College of Engineering, Mathematics and Physical Sciences, University of Exeter, Exeter, U.K.; School of Computer Science and Robotics, National Research Tomsk Polytechnic University (TPU), Tomsk, Russia; Chair of Pervasive and Mobile Computing, College of Computer and Information Sciences, King Saud University, Riyadh, Saudi Arabia",Publication Title,Publication Title
End-to-End Network Based on Transformer for Automatic Detection of Covid-19,C. Cai; B. Liu; J. Tao; Z. Tian; J. Lu; K. Wang,"CAS,National Laboratory of Pattern Recognition, Institute of Automation,Beijing,China; CAS,National Laboratory of Pattern Recognition, Institute of Automation,Beijing,China; CAS,National Laboratory of Pattern Recognition, Institute of Automation,Beijing,China; CAS,National Laboratory of Pattern Recognition, Institute of Automation,Beijing,China; CAS,National Laboratory of Pattern Recognition, Institute of Automation,Beijing,China; CAS,National Laboratory of Pattern Recognition, Institute of Automation,Beijing,China",Publication Title,Publication Title
Comorbidity Based Risk Prediction System for ARDS in COVID-19 Patients,N. Rajesh; V. T. Poulose; P. L. Umesh; R. M. Daniel,"Rajagiri School of Engineering and Technology,Department of Computer Science & Engineering,Kakkanad,Kerala,India; Rajagiri School of Engineering and Technology,Department of Computer Science & Engineering,Kakkanad,Kerala,India; Rajagiri School of Engineering and Technology,Department of Computer Science & Engineering,Kakkanad,Kerala,India; Rajagiri School of Engineering and Technology,Department of Computer Science & Engineering,Kakkanad,Kerala,India",Publication Title,Publication Title
Modelling New Cases of Covid-19 in the Philippines using Polynomial and MLP Regression,I. Tupal; R. Gustilo; M. Cabatuan,"De La Salle University,Gokongwei College of Engineering,Manila,Philippines; De La Salle University,Gokongwei College of Engineering,Manila,Philippines; De La Salle University,Gokongwei College of Engineering,Manila,Philippines",Publication Title,Publication Title
COVID-19 and Other Lung Disease Detection Using VGG19 Pretrained Features and Support Vector Machine,Y. Mangalmurti; N. Wattanapongsakorn,"King Mongkut's University of Technology Thonburi,Department of Computer Engineering,Bangkok,Thailand; King Mongkut's University of Technology Thonburi,Department of Computer Engineering,Bangkok,Thailand",Publication Title,Publication Title
"Effects of the Disastrous Pandemic COVID 19 on Learning Styles, Activities and Mental Health of Young Indian Students - A Machine Learning Approach",A. Khattar; P. R. Jain; S. M. K. Quadri,"Jamia Millia Islamia,Department of Computer Science,New Delhi,India; Jamia Millia Islamia,Department of Computer Science,New Delhi,India; Jamia Millia Islamia,Department of Computer Science,New Delhi,India",Publication Title,Publication Title
Machine learning approach for automatic lungs sound diagnosis from pulmonary signals,S. Rani; A. Chaurasia; M. K. Dutta; V. Myska; R. Burget,"Centre for Advanced Studies, AKTU,Computer Science and Engineering,Lucknow,India; Centre for Advanced Studies, AKTU,Computer Science and Engineering,Lucknow,India; Centre for Advanced Studies, AKTU,Computer Science and Engineering,Lucknow,India; Brno University of Technology,Department of Telecommunication,Brno,Czech Republic; Brno University of Technology,Department of Telecommunication,Brno,Czech Republic",Publication Title,Publication Title
Computational Decision Support for the COVID-19 Healthcare Coalition,A. Tolk; C. Glazner; J. Ungerleider,"MITRE Corporation, Charlottesville, VA, USA; MITRE Corporation, McLean, VA, USA; MITRE Corporation, McLean, VA, USA",Publication Title,Publication Title
Undergraduate's Perspective on Being an Effective Online Student During Lockdown due to COVID-19 Pandemic: An Educational Data Mining Study,E. Mondragon-Estrada; C. Camacho-Zu&#x00F1;iga,"School of Engineering and Science Tecnologico de Monterrey,Toluca,Mexico; School of Engineering and Science Tecnologico de Monterrey,Toluca,Mexico",Publication Title,Publication Title
Naïve Bayes Classifier for Predicting the Novel Coronavirus,S. Bhatia; J. Malhotra,"Guru Nanak Dev University,Computer Science Punjab School of Economics,Amritsar,India; Academics and Student’s Welfare GNDU Regional Campus,Jalandhar,India",Publication Title,Publication Title
Electronic News Sentiment Analysis Application to New Normal Policy During The Covid-19 Pandemic Using Fasttext And Machine Learning,R. P. Aluna; I. N. Yulita; R. Sudrajat,"Universitas Padjadjaran,Research Center for Artificial Intelligence and Big Data,Bandung,Indonesia; Universitas Padjadjaran,Research Center for Artificial Intelligence and Big Data,Bandung,Indonesia; Universitas Padjadjaran,Research Center for Artificial Intelligence and Big Data,Bandung,Indonesia",Publication Title,Publication Title
Data Augmentation and CNN Classification For Automatic COVID-19 Diagnosis From CT-Scan Images On Small Dataset,W. Tan; H. Guo,"LinkSprite Technologies,Longmont,CO,USA,80501; Shenzhen Deepcam Information Technologies,Shenzhen,China",Publication Title,Publication Title
Implementation of convolutional neural network for Covid-19 diagnosis,M. Bachute; N. Maheswari; L. Narang; A. Sunil; S. Kewlani,"Symbiosis Institute of Technology Pune-412115, Maharshtra, India; Symbiosis Institute of Technology Pune-412115, Maharshtra, India; Symbiosis Institute of Technology Pune-412115, Maharshtra, India; Symbiosis Institute of Technology Pune-412115, Maharshtra, India; Symbiosis Institute of Technology Pune-412115, Maharshtra, India",Publication Title,Publication Title
Cloud Computing and Covid-19,R. Singh,"Arizona State University,US",Publication Title,Publication Title
Covid-19 Data Visualization and Data Analytics with a Smart Standalone Mobile Application,A. Poddar; M. Poddar,"Surendranath Evening College,Department of Electronic Science,Kolkata,India,700009; Maharaja Manindra Chandra College,Department of Computer Science,Kolkata,India,700003",Publication Title,Publication Title
Forecasting of Covid-19 Using Time Series Regression Models,A. M. Radwan,"University College of Applied Sciences,Deanship of Information Technology,Gaza,Palestine",Publication Title,Publication Title
Predicting the Retweet Level of COVID-19 Tweets with Neural Network Classifier,Z. Qu; Z. Ding,"Centre for Operational Research and Analysis,Defence Research and Development Canada,Ottawa,Ontario,Canada; Ottawa Research Centre,Defence Research and Development Canada,Ottawa,Ontario,Canada",Publication Title,Publication Title
Feasibility Study of Detection of Coronavirus Disease 2019 with Microwave Medical Imaging,X. Lin; Z. Gong; Y. Ding; Y. Chen; P. A. Valdes Sosa; M. Joseph Valdes Sosa,"University of Waikato,School of Engineering,Hamilton,New Zealand; University of Waikato,School of Engineering,Hamilton,New Zealand; University of Electronic Science and Technology of China,School of Electronic Science and Engineering,Chengdu,China; University of Waikato,School of Engineering,Hamilton,New Zealand; University of Electronic Science and Technology of China,The Clinical Hospital of Chengdu Brain Science Institute,Chengdu,China; Cuba Neuroscience Center,Havana,Cuba",Publication Title,Publication Title
Intelligent Visual Interface for Assisted Digital Teaching Using Computer Vision,Abhishek; A. S. Rathore; A. Saxena; A. Sinha,"Jaypee Institute of Info. Tech.,Comp. Sc. &#x0026; Eng. &#x0026; Info. Tech.,Noida-62,Uttar Pradesh,India; Jaypee Institute of Info. Tech.,Comp. Sc. &#x0026; Eng. &#x0026; Info. Tech.,Noida-62,Uttar Pradesh,India; Jaypee Institute of Info. Tech.,Comp. Sc. &#x0026; Eng. &#x0026; Info. Tech.,Noida-62,Uttar Pradesh,India; Jaypee Institute of Info. Tech.,Comp. Sc. &#x0026; Eng. &#x0026; Info. Tech.,Noida-62,Uttar Pradesh,India",Publication Title,Publication Title
Face Mask Detection using Haar Cascade Classifier Algorithm based on Internet of Things with Telegram Bot Notification,A. Rahmatulloh; R. Gunawan; H. Sulastri; I. Pratama; I. Darmawan,"Siliwangi University,Department of Informatics,Tasikmalaya,Indonesia; Siliwangi University,Department of Informatics,Tasikmalaya,Indonesia; Siliwangi University,Department of Informatics,Tasikmalaya,Indonesia; Siliwangi University,Department of Informatics,Tasikmalaya,Indonesia; Telkom University,Department of Information System,Bandung,Indonesia",Publication Title,Publication Title
Sentiment Classification on Twitter and Zomato Dataset Using Supervised Learning Algorithms,R. S. Jagdale; S. S. Deshmukh,"Dr. B. A. M., University, Aurangabad,Department of CS and IT,Aurangabad,Maharashtra,India; JNEC, MGM University,Department of MCA,Aurangabad,Maharashtra,India",Publication Title,Publication Title
Analytical and Predictive Model for the impact of social distancing on COVID-19 pandemic,S. Sharma; I. Alsmadi; R. S. Alkhawaldeh; B. Al-Ahmad,"Syracuse University,College of Engineering and Computer Science,NY,USA; Texas A&#x0026;M University,Department of Computing and Cyber Security,Texas,USA; The University of Jordan, Aqaba,Department of Computer Information Systems,Aqaba,Jordan; The University of Jordan, Aqaba,Department of Computer Information Systems,Aqaba,Jordan",Publication Title,Publication Title
Covid-19 Confirmed-Cases Prediction in SAARC Countries through Machine Learning,A. S. Saha; M. Haque; M. G. R. Alam,"BRAC University,Department of Computer Science and Engineering,Dhaka,Bangladesh; BRAC University,Department of Computer Science and Engineering,Dhaka,Bangladesh; BRAC University,Department of Computer Science and Engineering,Dhaka,Bangladesh",Publication Title,Publication Title
A Comparison among Distinct Deep Learning Techniques for Real-Time Testing of Covid-19 Infected Patient using Chest Radiography,S. Gupta; A. Panwar; D. Rawat,"Graphic Era Deemed to be University,CSE Department,Dehradun,India; Graphic Era Hill University,CSE Department,Dehradun,India; Graphic Era Deemed to be University,CSE Department,Dehradun,India",Publication Title,Publication Title
COVID-19 in India: Lockdown analysis and future predictions using Regression models,K. Prathyusha; K. Helini; C. V. Raghavendran; N. Kumar Kurumeti,"Vignan’s Institute of Management and Technology for Women,Department of Computer Science & Engineering,Hyderabad,Telangana,India; Vignan’s Institute of Management and Technology for Women,Department of Computer Science & Engineering,Hyderabad,Telangana,India; Aditya College of Engineering & Technology,Department of Information Technology,Surampalem,Andhra Pradesh,India; Aditya Engineering College(A),Department of Computer Science & Engineering,Surampalem,Andhra Pradesh,India",Publication Title,Publication Title
Life Table Forecasting in COVID-19 Times: An Ensemble Learning Approach,A. Ashofteh; J. M. Bravo,"Universidade Nova de Lisboa,NOVA Information Management School (NOVA IMS),Lisbon,Portugal; Universidade Nova de Lisboa & Université Paris-Dauphine & MagIC & CEFAGE-UE,NOVA IMS,Lisbon,Portugal",Publication Title,Publication Title
Analysing Public Sentiments Regarding COVID-19 Vaccine on Twitter,K. Rahul; B. R. Jindal; K. Singh; P. Meel,"Delhi Technological University,Department of Information Technology,Delhi,India; Delhi Technological University,Department of Information Technology,Delhi,India; Delhi Technological University,Department of Information Technology,Delhi,India; Delhi Technological University,Department of Information Technology,Delhi,India",Publication Title,Publication Title
Internet of things and Health Care in Pandemic COVID -19: System requirments evaluation,H. K. Naji; N. Goga; A. J. M. Karkar; I. Marin; H. A. Ali,"University Politehnica of Bucharest,Doctoral School of Automatic Control and Computers,Bucharest,Romania; University Politehnica of Bucharest,Faculty of Engineering in Foreign Languages,Bucharest,Romania; University of Kufa,IT Research and Development Centre,Electronic and Communication Engineering Department,Najaf,Iraq; University Polytechnic of Bucharest,Faculty of Engineering in Foreign Languages,Bucharest,Romania; University Politehnica of Bucharest,Doctoral School of Automatic Control and Computers,Bucharest,Romania",Publication Title,Publication Title
DeCoP:Deep Learning for COVID-19 Prediction of Survival,Y. Deng; S. Liu; A. Jolfaei; H. Cheng; Z. Wang; X. Zheng,"Department of Computing, Macquarie University, Sydney, NSW, Australia; School of Software and Electrical Engineering, Swinburne University of Technology, Melbourne, VIC, Australia; Department of Computing, Macquarie University, Sydney, NSW, Australia; College of Computer, Zhejiang University of Technology, Hangzhou, China; School of Software and Electrical Engineering, Swinburne University of Technology, Melbourne, VIC, Australia; Department of Computing, Macquarie University, Sydney, NSW, Australia",Publication Title,Publication Title
Identifying Factors in COVID - 19 AI Case Predictions,L. Pickering; J. Viana; X. Li; A. Chhabra; D. Patel; K. Cohen,"University of Cincinnati,Cincinnati,U.S.A.,Ohio 45219; University of Cincinnati,Cincinnati,U.S.A.,Ohio 45219; University of Cincinnati,Cincinnati,U.S.A.,Ohio 45219; University of Cincinnati,Cincinnati,U.S.A.,Ohio 45219; University of Cincinnati,Cincinnati,U.S.A.,Ohio 45219; University of Cincinnati,Cincinnati,U.S.A.,Ohio 45219",Publication Title,Publication Title
Adaptive Self-Paced Transfer Learning for COVID-19 Diagnosis with CXR Images,Y. Yao; Q. Zhu; H. Ye; D. Zhang,"Nanjing University of Aeronautics and Astronautics,College of Computer Science and Technology,Nanjing,China; Nanjing University of Aeronautics and Astronautics,College of Computer Science and Technology,Nanjing,China; Nanjing University of Aeronautics and Astronautics,College of Computer Science and Technology,Nanjing,China; Nanjing University of Aeronautics and Astronautics,College of Computer Science and Technology,Nanjing,China",Publication Title,Publication Title
Artificial Intelligence Based Prediction of Covid-19 using Chest CT Scan,N. Shamim; A. Mital; Yogesh,"Amity University,Department of Electronics and Communication Engineering,Noida,Uttar Pradesh,India,201313; Amity University,Department of Electronics and Communication Engineering,Noida,Uttar Pradesh,India,201313; Amity University,Department of Information Technology,Noida,Uttar Pradesh,India,201313",Publication Title,Publication Title
Bayesian Inference in Census-House Dataset,H. Shu,"Newcasle University,School of Computer,Newcastle,United Kingdom",Publication Title,Publication Title
Predictive Analytics Comparison of Achieving Herd Immunity from COVID-19 in Indonesia and India Based on Fully Vaccinated People,A. Budiyanto; M. Anggraini; A. N. Hidayanto,"Universitas Indonesia,Faculty of Computer Science,Jakarta,Indonesia; Universitas Indonesia,Faculty of Computer Science,Jakarta,Indonesia; Universitas Indonesia,Faculty of Computer Science,Jakarta,Indonesia",Publication Title,Publication Title
COVID-19 Detection Through Transfer Learning Using Multimodal Imaging Data,M. J. Horry; S. Chakraborty; M. Paul; A. Ulhaq; B. Pradhan; M. Saha; N. Shukla,"Centre for Advanced Modelling and Geospatial Information Systems (CAMGIS), School of Information, Systems, and Modeling, Faculty of Engineering and IT, University of Technology Sydney, Sydney, NSW, Australia; Centre for Advanced Modelling and Geospatial Information Systems (CAMGIS), School of Information, Systems, and Modeling, Faculty of Engineering and IT, University of Technology Sydney, Sydney, NSW, Australia; Machine Vision and Digital Health (MaViDH), School of Computing and Mathematics, Charles Sturt University, Bathurst, NSW, Australia; Machine Vision and Digital Health (MaViDH), School of Computing and Mathematics, Charles Sturt University, Bathurst, NSW, Australia; Centre for Advanced Modelling and Geospatial Information Systems (CAMGIS), School of Information, Systems, and Modeling, Faculty of Engineering and IT, University of Technology Sydney, Sydney, NSW, Australia; Manning Rural Referral Hospital, Taree, NSW, Australia; Centre for Advanced Modelling and Geospatial Information Systems (CAMGIS), School of Information, Systems, and Modeling, Faculty of Engineering and IT, University of Technology Sydney, Sydney, NSW, Australia",Publication Title,Publication Title
Introducing the GEV Activation Function for Highly Unbalanced Data to Develop COVID-19 Diagnostic Models,J. Bridge; Y. Meng; Y. Zhao; Y. Du; M. Zhao; R. Sun; Y. Zheng,"Institute of Life Course and Medical Sciences, University of Liverpool, Liverpool, L7 8TX, U.K.; Institute of Life Course and Medical Sciences, University of Liverpool, Liverpool, L7 8TX, U.K.; Cixi Institute of Biomedical Engineering, Ningbo Institute of Materials Technology and Engineering, Chinese Academy of Sciences, Ningbo, China; Department of Nuclear Medicine, The Royal Marsden NHS Foundation Trust, Sutton, U.K.; Department of Hematology, Tianjin First Central Hospital, the First Central Clinical College of Tianjin Medical University, Tianjin, China; Department of Radiology, Hubei Provincial Hospital of Integrated Chinese and Western Medicine, Hubei University of Chinese Medicine, Wuhan, China; Institute of Life Course and Medical Sciences, University of Liverpool, Liverpool, L7 8TX, U.K.",Publication Title,Publication Title
Data Mining of Weibo for Public Sentiment Evolution regarding COVID-19,L. Li; W. Zhao; W. Mao; C. Ye; X. Chu; Z. Chu,"Shenzhen University,College of Management,Shenzhen,China; Shenzhen University,College of Management,Shenzhen,China; Shenzhen University,College of Management,Shenzhen,China; Tianjin University,College of Management and Economics,Tianjin,China; Shenzhen University,College of Management,Shenzhen,China; University of Manitoba,Department of Mechanical Engineering,Winnipeg,Canada",Publication Title,Publication Title
Datasets and Approaches of COVID-19 Misinformation Detection: A Survey,M. Gharaibeh; R. Obeidat; M. Abdullah; Y. Al-Harahsheh,"Jordan University of Science and Technology,Department of Computer Science; Jordan University of Science and Technology,Department of Computer Science; Jordan University of Science and Technology,Department of Computer Science; Jordan University of Science and Technology,Department of Computer Science",Publication Title,Publication Title
COVID-19 impact on students' Mental Health: Explainable AI and Classifiers,A. Ul Hussna; I. Immami Trisha; I. Jahan Ritun; M. G. Rabiul Alam,"BRAC University,Department of Computer Science and Engineering,Dhaka,Bangladesh; BRAC University,Department of Computer Science and Engineering,Dhaka,Bangladesh; BRAC University,Department of Computer Science and Engineering,Dhaka,Bangladesh; BRAC University,Department of Computer Science and Engineering,Dhaka,Bangladesh",Publication Title,Publication Title
A Prediction Model of In-Patient Deteriorations Based on Passive Vital Signs Monitoring Technology,V. Maidel; M. L. Yizraeli Davidovich; Z. Shinar; T. Klap,"EarlySense Ltd.,Ramat Gan,Israel; EarlySense Ltd.,Ramat Gan,Israel; MindUP,Haifa,Israel; EarlySense Ltd.,Ramat Gan,Israel",Publication Title,Publication Title
A Digital Health System for Disease Analytics,C. K. Leung; D. L. X. Fung; T. H. Daniel Mai; J. Souza; N. D. Thong Tran,"University of Manitoba,Department of Computer Science,Winnipeg,MB,Canada; University of Manitoba,Department of Computer Science,Winnipeg,MB,Canada; University of Manitoba,Department of Computer Science,Winnipeg,MB,Canada; University of Manitoba,Department of Computer Science,Winnipeg,MB,Canada; University of Manitoba,Department of Computer Science,Winnipeg,MB,Canada",Publication Title,Publication Title
Effectiveness of Network Interdiction Strategies to Limit Contagion During a Pandemic,S. Roy; P. Biswas; P. Ghosh,"Department of Genetics, University of North Carolina at Chapel Hill, Chapel Hill, NC, USA; School of Computing, Informatics, and Decision Systems Engineering, Arizona State University, Tempe, AZ, USA; Department of Computer Science, Virginia Commonwealth University, Richmond, VA, USA",Publication Title,Publication Title
A Deep Transfer Learning Approach to Diagnose Covid-19 using X-ray Images,N. Ilma Progga; M. Shahadat Hossain; K. Andersson,"University of Chittagong,Department of Computer Science and Engineering,Chittagong,Bangladesh; University of Chittagong,Department of Computer Science and Engineering,Chittagong,Bangladesh; Lule University of Technology,Department of Computer Science, Electrical and Space Engineering,Skellefte,Sweden",Publication Title,Publication Title
Portable Health Monitoring Module using Machine Learning,A. Debnath; B. Dey; S. K. Routray,"CMR Institute of Technology,Electronics and Communication Dept.,Bengaluru; Sikkim Manipal Institute of Technology,Electronics and Communication Dept.,Sikkim,SMU; Bule Hora University,Dept of Electrical and Computer Eng,Bule Hora,Ethiopia",Publication Title,Publication Title
Non-invasive Machine Learning approach for classifying Blood Pressure using PPG Signals in COVID situation,B. Durga Siva Praveen; D. V. N. Sandeep; I. V. V. Raghavendra; M. Yuvaraj; S. Sarath,"Amrita Vishwa Vidyapeetham,Department Of Computer Science and Engineering,Amritapuri,India; Amrita Vishwa Vidyapeetham,Department Of Computer Science and Engineering,Amritapuri,India; Amrita Vishwa Vidyapeetham,Department Of Computer Science and Engineering,Amritapuri,India; Amrita Vishwa Vidyapeetham,Department Of Computer Science and Engineering,Amritapuri,India; Amrita Vishwa Vidyapeetham,Department Of Computer Science and Engineering,Amritapuri,India",Publication Title,Publication Title
Health Insurance Cost Prediction using Machine Learning,K. Bhatia; S. S. Gill; N. Kamboj; M. Kumar; R. K. Bhatia,"Punjabi University,Department of Computer Science and Engineering,Patiala,India; Indraprastha Institute of Information Technology,Department of Computer Science and Engineering,Delhi,India; Amazon,Big Data Engineer; Punjab Engineering College,Department of Computer Science and Engineering,Chandigarh,India; Punjab Engineering College,Department of Computer Science and Engineering,Chandigarh,India",Publication Title,Publication Title
"The impact of Artificial Intelligence, Blockchain, Big Data and evolving technologies in Coronavirus Disease - 2019 (COVID-19) curtailment",S. Ahir; D. Telavane; R. Thomas,"Vivekanand Education Society’s Institute of Technology,Mumbai,India; EbixCash Financial Technologies,Mumbai,India; Vivekanand Education Society’s Institute of Technology,Mumbai,India",Publication Title,Publication Title
